src	keywords
It is very interesting has a great cast and awesome storyline	"Interesting/engaging,Good cast/actors,Good storyline/subject matter,,,,"
Thandie Newton ‘nuff said.	"Like Thandie Newton,,,,,,"
It doesn't. I don't watch it.	"All negative mentions,,,,,,"
Decent show	"Good/like the show/everything,,,,,,"
The plot and the complexity of the show is amazing.	"Good storyline/subject matter,Complex storyline,,,,,"
I just like the futuristic storyline and the complex story and twists.	"Futuristic,Complex storyline,Suspense/Mystery/thrillers,,,,"
?	"Don't know,,,,,,"
very good	"Good/like the show/everything,,,,,,"
Season one was original and unique. Reviews of seasons 2 and three say it's lost its way.	"Original,Unique/different,,,,,"
I like that it's a way to go back and forth between words and also live how they main characters live without exists and other worldly beings and put of this world beings	"Other storyline/Plot mentions,Other characters mentions,,,,,"
The writing is superb. Love watching the characters develop over time. The actors themselves are convincing in their roles.	"Like the writing/dialog,Appealing characters/I like the characters,Good cast/actors,,,,"
Everything!	"Good/like the show/everything,,,,,,"
"You feel like you're untangling a gigantic, complex knot that reveals new twists and turns with each layer that comes unraveled. It's engaging and riveting"	"Suspense/Mystery/thrillers,Interesting/engaging,,,,,"
I just like it	"Good/like the show/everything,,,,,,"
THERES REALLY NOTHING I WATCHED PARTS OF 3 EPISODES AND NEVER REALLY GOT INTO IT	"All negative mentions,,,,,,"
"Westworld literally plays you. It plays you as assuredly as the skeletal fingers that dance across the piano keys in the title sequence. Each episode draws you in and seduces you with the promise of revelations, before flipping those expectations on their head and delivering something more interesting and finely crafted than you’d thought possible. Not only that, though, Westworld’s episodes subtly seed persistent narrative elements that coalesce when the show is ready to reveal its secrets to the viewer."	"Attention grabbing/holds interest/keeps you wanting to watch more,Interesting/engaging,Suspense/Mystery/thrillers,,,,"
i love the cast and the plots. the writers are great and keep me coming back for every single episode. i love it	"Good cast/actors,Like the premise/setting/scenery,Like the writing/dialog,Attention grabbing/holds interest/keeps you wanting to watch more,,,"
I watched the first two seasons	"Have not watched enough to comment/not familiar with the show,,,,,,"
i like very much	"Good/like the show/everything,,,,,,"
its very interesting	"Interesting/engaging,,,,,,"
i just thnik it is a really interesting and unique show	"Interesting/engaging,Unique/different,,,,,"
offers good service	"Other misc. mentions,,,,,,"
the actors and the diologe	"Good cast/actors,Like the writing/dialog,,,,,"
"I like the concept of it, it's very interesting and thought-provoking."	"Like the concept/idea of futuristic amusement park,Interesting/engaging,Thought provoking,,,,"
I love the action and drama and thandie Newton's character	"Like the action/adventurous,Like the drama,Other characters mentions,,,,"
The interesting sci fi western combination with good writing	"Interesting/engaging,Science fiction/fantasy,Like the writing/dialog,,,,"
Exciting story line	"Exciting,Good storyline/subject matter,,,,,"
None	"None/no answer,,,,,,"
It is very furhurres	"Futuristic,,,,,,"
"I really love the cast as well as the overall storyline. It is so different than anything out right now, and it is so captivating."	"Good cast/actors,Good storyline/subject matter,Unique/different,Attention grabbing/holds interest/keeps you wanting to watch more,,,"
I just enjoy it	"Witty/humorous/funny/entertaining,,,,,,"
great	"Good/like the show/everything,,,,,,"
i really liked the movie and spreading beyond that and focuses on things that are relevant to today is exciting	"Already seen/like the original movie,Relevant to 21st century/existing in the world today/reflects our current society,,,,,"
very god eay teu more eys fn eys moge oddo	"None/no answer,,,,,,"
The action and the characters	"Like the action/adventurous,Appealing characters/I like the characters,,,,,"
it makes you be on the edge of your seat and keeps you guessing about what will happen	"Attention grabbing/holds interest/keeps you wanting to watch more,,,,,,"
The creative and beautiful story telling and environment	"Creative/innovative/modern,Good storyline/subject matter,Other misc. mentions,,,,"
The concept and the aesthetic of the setting appeals to me	"Like the concept/idea of futuristic amusement park,Like the premise/setting/scenery,,,,,"
New lines	"Unique/different,,,,,,"
What makes it a good show is that it strings you along so easily that I can't not watch. It has a future that is very crazy to think about and that is what draws you in.	"Futuristic,Attention grabbing/holds interest/keeps you wanting to watch more,,,,,"
Interesting concepts and constant world changing	"Interesting/engaging,Like the concept/idea of futuristic amusement park,Other show type mentions,,,,"
overall this is a really great show nand i would say that it is one of the best shows that is currently in the market	"Good/like the show/everything,,,,,,"
"i think its a unique and original type of show, as well as that its futuristic"	"Unique/different,Original,Futuristic,,,,"
The overall story and the actors involved.	"Good storyline/subject matter,Good cast/actors,,,,,"
each character feel like they could be the main character of the show	"Appealing characters/I like the characters,,,,,,"
It's a good ahow	"Good/like the show/everything,,,,,,"
It is more entertaining when talking about artificial intelligence between the ties of the characters	"Witty/humorous/funny/entertaining,Technological aspects (inclusion of robots, exploring AI, etc.),Like the characters development,,,,"
sci fi mixed with western and different cultures mixed in	"Science fiction/fantasy,Other storyline/Plot mentions,,,,,"
It’s fantastic show that I ever watch it.	"Good/like the show/everything,,,,,,"
the thrilling action	"Like the action/adventurous,,,,,,"
vbfg	"None/no answer,,,,,,"
Futuristic elements that seem real because of the great character development	"Futuristic,Like the characters development,,,,,"
"It is a great series, it has a great special effect and the best written shows does it all at once. Westworld is very unique"	"Good/like the show/everything,Good visuals/graphics/special effects,Like the writing/dialog,Unique/different,,,"
"What makes it a good show is that it genuinely explores the cynical, violent relationship that humans have for others people, other things, and the desire to dehumanize all in the name of self-indulgence. I really enjoyed season 3 by how it goes beyond just the parks into almost replicant infiltration into our society."	"Other storyline/Plot mentions,Witty/humorous/funny/entertaining,Relevant to 21st century/existing in the world today/reflects our current society,,,,"
It’s just interesting eith nothing like it out their	"Interesting/engaging,,,,,,"
the story of the show is great .that s why i like it very much	"Good storyline/subject matter,Good/like the show/everything,,,,,"
Husband likes it	"Good/like the show/everything,,,,,,"
great writing with complex characters	"Like the writing/dialog,Like the character complexity,,,,,"
I like the idea that westworld is a theme park and all the technology there is to give it that perfect touch of the old west. The theme of the hosts is very interesting	"Like the concept/idea of futuristic amusement park,Technological aspects (inclusion of robots, exploring AI, etc.),Other acting mentions,,,,"
"His good controversial story, where he causes empathy with his characters ad that makes him want to see more"	"Other storyline/Plot mentions,Other characters mentions,,,,,"
nothing more than whats being done now	"Good/like the show/everything,,,,,,"
the sci fi and action	"Science fiction/fantasy,Like the action/adventurous,,,,,"
I don’t know	"Don't know,,,,,,"
Westworld is good because there is a lot of material to work with and is not a generic plot line. The cast and the writing make the show.	"Good/like the show/everything,Informative/detailed,Good cast/actors,Like the writing/dialog,,,"
"The acting, characters, plot"	"Good acting,Good storyline/subject matter,,,,,"
The character interactions.	"Like the characters interaction,,,,,,"
werujiuhgfrdswetgyhujygfswetghujhgfdesdghjmhgvfcdx	"None/no answer,,,,,,"
i like the idea of people interacting with AI robots	"Like the characters interaction,,,,,,"
it was so great	"Good/like the show/everything,,,,,,"
none	"None/no answer,,,,,,"
i like the story	"Good storyline/subject matter,,,,,,"
The idea that there are AI all over & you can't tell who is who.	"Technological aspects (inclusion of robots, exploring AI, etc.),Suspense/Mystery/thrillers,,,,,"
constant twist and turns in the plot	"Suspense/Mystery/thrillers,,,,,,"
The developing storyline. How it explores how each character has arrived at this point	"Good storyline/subject matter,Appealing characters/I like the characters,,,,,"
the cast	"Good cast/actors,,,,,,"
always unexpected. makes you work and think while watching. Intelligent	"Suspense/Mystery/thrillers,Attention grabbing/holds interest/keeps you wanting to watch more,,,,,"
How it takes place and the whole story line	"Good storyline/subject matter,,,,,,"
GOOD	"Good/like the show/everything,,,,,,"
The story line and the character's	"Good storyline/subject matter,Appealing characters/I like the characters,,,,,"
I'm a fan of sci-fi. And this sci-fi is excellent	"Science fiction/fantasy,,,,,,"
I watch it sometimes because my boyfriend likes it.	"Have not watched enough to comment/not familiar with the show,,,,,,"
It is made so well - and the action is big and gory - I like the actors too	"Other show characteristic mentions,Like the action/adventurous,Violence,Good cast/actors,,,"
There is nothing else like it and it feels that our world is headed in the same direction. all the data and privacy issues and people at the top always win and us at the bottom can't even get a job. Feels like we don't have a choice sometimes.	"Other storyline/Plot mentions,,,,,,"
The story	"Good storyline/subject matter,,,,,,"
I like to binge watch. It has an interesting storyline that keeps me engaged.	"Interesting/engaging,,,,,,"
The unexpected twists are great. The control over our destinies is really thought provoking	"Suspense/Mystery/thrillers,Thought provoking,,,,,"
With all the action and drama that the show has makes it even more interesting to keep watching and waiting for next weeks episode.	"Like the action/adventurous,Like the drama,Attention grabbing/holds interest/keeps you wanting to watch more,,,,"
Westworld is amazing one of the best shows ever	"Good/like the show/everything,,,,,,"
its sees too good than other movie or other series so its too good than other things really it was too good	"Good/like the show/everything,,,,,,"
Thinking about if this canreally happen in the future.	"Futuristic,,,,,,"
"The characters are interesting, and the hosts finally gaining their own agency is exciting to watch."	"Appealing characters/I like the characters,Exciting,,,,,"
Just a fun story line	"Witty/humorous/funny/entertaining,,,,,,"
Mostly the cast and production value.	"Good cast/actors,High quality show/high production values,,,,,"
A.I. becomes real with emotions like humans and can be reprogrammed. The future of being there be kinda weird.	"All negative mentions,,,,,,"
The futuristic possibilities make it a good show	"Futuristic,Good/like the show/everything,,,,,"
I like the idea of artificial intelligence and the cruelty of mankind that this show brings to light	"Like the concept/idea of futuristic amusement park,Technological aspects (inclusion of robots, exploring AI, etc.),Other realistic/association with real life mentions,,,,"
"Complex ideas, interesting world and characters"	"Complex storyline,Interesting/engaging,Like the premise/setting/scenery,Appealing characters/I like the characters,,,"
Westworld	"Good/like the show/everything,,,,,,"
My husband watches it and I’m in the room	"Have not watched enough to comment/not familiar with the show,,,,,,"
It makes a good show because it’s something different I haven’t seen on tv before	"Good/like the show/everything,Unique/different,,,,,"
the original movie	"Already seen/like the original movie,,,,,,"
It always has me thinking	"Attention grabbing/holds interest/keeps you wanting to watch more,,,,,,"
"I think Westworld is interesting because I think that our world could end up looking like this very soon. Artificial intelligence is quite interesting to me. Who knows where we're going to end up. I don't know if we will treat robots this way, but I feel like it's a possibility."	"Interesting/engaging,Technological aspects (inclusion of robots, exploring AI, etc.),,,,,"
greart	"Good/like the show/everything,,,,,,"
the show is totally different. i love everything about the show. i like shows that are unique	"Unique/different,Good/like the show/everything,,,,,"
weqrweqrcwercweqrcwerqwerrcweqrcqwerc	"None/no answer,,,,,,"
Seeing the plot developments and what happens to the characters.	"Good storyline/subject matter,Appealing characters/I like the characters,,,,,"
The line between morality for a character that is not technically alive	"Other misc. mentions,,,,,,"
The complex characters and twisty turny story	"Like the character complexity,Suspense/Mystery/thrillers,,,,,"
like sci-fi	"Science fiction/fantasy,,,,,,"
"I was very interested in season one. I did not automatically love the show, but I was always wondering what would happen in the next episode. Season two was disappointing to me and I lost some of my overall interest. However, I really liked the story lines with Shogun World and the Ghost Nation. I was even less interested in season three - I miss the parks and I think they left the parks too early in the series. I don't care about the real world as much."	"All negative mentions,,,,,,"
I like the genre and the exploration of potential future worlds	"Like the genre,Futuristic,,,,,"
"great plot twists, good acting"	"Suspense/Mystery/thrillers,Good cast/actors,,,,,"
It focuses on a futuristic story line but still has old western elements	"Futuristic,Good storyline/subject matter,Western aspect,,,,"
see what new challenge you are in and how you can face it or what it brings	"Relevant to 21st century/existing in the world today/reflects our current society,,,,,,"
The inclusion of robots and artificial intelligence. The depiction of the world and how it relates to our current world. Wish it would explore the futuristic elements more.	"Technological aspects (inclusion of robots, exploring AI, etc.),Relevant to 21st century/existing in the world today/reflects our current society,Futuristic,,,,"
Some of my friends are watching it	"Heard good review/recommendations by family/friends,,,,,,"
The story and characters	"Good storyline/subject matter,Appealing characters/I like the characters,,,,,"
The performance of its protagonists in special the performance of ed harris and the plot as such of the series	"Good acting,Like Ed Harris,Good storyline/subject matter,,,,"
It is very intriguing and good.	"Interesting/engaging,Good/like the show/everything,,,,,"
A VERY NICE CLEAR IMAGE AND SCENE AND THRILLING PLOT THAT MAKE YOU THINK AND I LIKE THE CHARACTERS	"Good visuals/graphics/special effects,Suspense/Mystery/thrillers,Like the premise/setting/scenery,Thought provoking,Appealing characters/I like the characters,,"
i seen previous seasons	"Have not watched enough to comment/not familiar with the show,,,,,,"
i like it very much this story	"Good/like the show/everything,Good storyline/subject matter,,,,,"
some of the characters	"Appealing characters/I like the characters,,,,,,"
Not sure if I understand your question.	"Don't know,,,,,,"
I like the setting. I really enjoy seeing the air as a new species of life	"Like the premise/setting/scenery,Witty/humorous/funny/entertaining,,,,,"
nothing specific	"None/no answer,,,,,,"
A good show for family.	"Good/like the show/everything,Can watch with family/family likes the show,,,,,"
The other world theme. The idea that we can create artificial intelligence that is essentially human. So human it make you feel bad for the machines.	"Like the concept/idea of futuristic amusement park,Technology involvement/overpowering human life,,,,,"
Good	"Good/like the show/everything,,,,,,"
It is visually stunning. The story line is intriguing. They consistently have super talented actors.	"Good visuals/graphics/special effects,Interesting/engaging,Good cast/actors,,,,"
Storyline	"Good storyline/subject matter,,,,,,"
I think the character development and script are amazing. I also like that the storyline is always really interesting and there’s never a dull moment.	"Like the characters development,Good storyline/subject matter,Interesting/engaging,,,,"
yes	"None/no answer,,,,,,"
I don't really care for watching it anymore because season 2 was a cluster *&@!# and made the show *&@!#	"All negative mentions,,,,,,"
I think the cast	"Good cast/actors,,,,,,"
"It keeps me wondering what the heck is going on, so I watch to figure it out"	"Attention grabbing/holds interest/keeps you wanting to watch more,,,,,,"
the action	"Like the action/adventurous,,,,,,"
"The sci fi aspect, I enjoy the characters and Wild West mixed with robots."	"Science fiction/fantasy,Appealing characters/I like the characters,Technological aspects (inclusion of robots, exploring AI, etc.),,,,"
I like it because it’s not like other shows I like that is is engaging and interesting. They whole idea of the show has always reminded me of a Dream world	"Interesting/engaging,Like the concept/idea of futuristic amusement park,,,,,"
nothing	"None/no answer,,,,,,"
The plot is very different but not crazy enough for audience to not understand. Nice twists as well in the storyline.	"Unique/different,Suspense/Mystery/thrillers,,,,,"
the acting. the sci-fi storyline. the complex storyline. I want to know what is going on.	"Good acting,Science fiction/fantasy,Complex storyline,Attention grabbing/holds interest/keeps you wanting to watch more,,,"
it was good	"Good/like the show/everything,,,,,,"
The story and human reality	"Good storyline/subject matter,Looks realistic,,,,,"
The not knowing part	"Suspense/Mystery/thrillers,,,,,,"
it was cool	"Good/like the show/everything,,,,,,"
greet	"Good/like the show/everything,,,,,,"
n/a	"None/no answer,,,,,,"
the story of the show and how it is going.	"Good storyline/subject matter,Suspense/Mystery/thrillers,,,,,"
I like to watch	"Good/like the show/everything,,,,,,"
"I truly love the way they interweave the artificial intelligence aspect with real life struggles and the robots' desire to become liberated. It's an aspect that every feeling, thinking human being longs for and apparently so do robots when they're created by humans who understand that. Westworld, for me is the complete understanding that if you create it and then break it, you have to fix it or make it better. There's also a privacy issue at stake in this movie that is a little concerning to me."	"Technological aspects (inclusion of robots, exploring AI, etc.),,,,,,"
The characters and the story line. I love Bernard and Delores.	"Appealing characters/I like the characters,Good storyline/subject matter,Other characters mentions,Like the character Dolores Abernathy,,,"
"I love the concept of AI beings achieving sentience, and the cast is amazing individually and together. The evolving issues and pace are perfect and draw you in like good sci-fi used to do."	"Like the concept/idea of futuristic amusement park,Technological aspects (inclusion of robots, exploring AI, etc.),Good cast/actors,Other show characteristic mentions,Attention grabbing/holds interest/keeps you wanting to watch more,Science fiction/fantasy,"
hbbyuy	"None/no answer,,,,,,"
Compelling characters and great story lines!	"Appealing characters/I like the characters,Good storyline/subject matter,,,,,"
Never know what's going to happen. It keeps me guessing.	"Suspense/Mystery/thrillers,,,,,,"
It's unique	"Unique/different,,,,,,"
it compels you to keep following looking for explanations and answers	"Attention grabbing/holds interest/keeps you wanting to watch more,,,,,,"
it grabs my attention from beginning to end of every episode	"Attention grabbing/holds interest/keeps you wanting to watch more,,,,,,"
The writing and story line MADE it a good show. Now the writing and story line is terrible. Stopped watching halfway through the second episode of the new season.	"Good storyline/subject matter,Like the writing/dialog,,,,,"
THrilling show.very interested	"Suspense/Mystery/thrillers,Interesting/engaging,,,,,"
good quality acting. love sci fi shows in general. Love the way the robots think/act so much like humans but are completely different in motivations. Want to see what happens next.	"Good acting,Science fiction/fantasy,Technological aspects (inclusion of robots, exploring AI, etc.),Attention grabbing/holds interest/keeps you wanting to watch more,,,"
The characters in the show and the story line.	"Appealing characters/I like the characters,Good storyline/subject matter,,,,,"
na	"None/no answer,,,,,,"
LOVE DELORES ROLE	"Like the character Dolores Abernathy,,,,,,"
I remember seeing the movie when I was younger. This is a good adaptation of it.	"Good/like the show/everything,,,,,,"
The characters and the storyline	"Appealing characters/I like the characters,Good storyline/subject matter,,,,,"
I have only seen one show but I guess the fact that it pertains to science fiction.	"Have not watched enough to comment/not familiar with the show,Science fiction/fantasy,,,,,"
The plot	"Good storyline/subject matter,,,,,,"
Fun	"Witty/humorous/funny/entertaining,,,,,,"
it has such a good storyline and great characters!	"Good storyline/subject matter,Appealing characters/I like the characters,,,,,"
The plot and storyline	"Good storyline/subject matter,,,,,,"
Dolores’ storyline. She is a strong feminine chsracter	"Like the character Dolores Abernathy,Good storyline/subject matter,,,,,"
ajdflajdfkjsadf;js;fsjaf	"None/no answer,,,,,,"
"High quality, interesting story"	"High quality show/high production values,Interesting/engaging,Good storyline/subject matter,,,,"
Good flick	"Good/like the show/everything,,,,,,"
A good show offers an escape from the real world without being stupid and/or too complicated.	"Good/like the show/everything,Other show characteristic mentions,,,,,"
nothing	"None/no answer,,,,,,"
My husband watches it and I see some of the show while he watches it.	"Have not watched enough to comment/not familiar with the show,,,,,,"
"The appealing action, story, show"	"Like the action/adventurous,Good storyline/subject matter,Good/like the show/everything,,,,"
It’s visually stunning with compelling characters and fantastic premise but so damn hard to follow. I usually have to watch each episode twice to understand what happened	"Attention grabbing/holds interest/keeps you wanting to watch more,Appealing characters/I like the characters,Good storyline/subject matter,,,,"
"This third season lost all of its charm to me. The end of the second season was so confusing, and the beginning of this one is not interesting. Super disappointed.. will probably not watch the rest of this season"	"All negative mentions,,,,,,"
Nothing	"None/no answer,,,,,,"
The special effects and acting are good.	"Good visuals/graphics/special effects,Good acting,,,,,"
The look into the future. The cast is great actors.	"Futuristic,Good cast/actors,,,,,"
It's ciol	"Good/like the show/everything,,,,,,"
The fact that it integrates elements of westerns into it.	"Western aspect,,,,,,"
"Heard good things including cast, writing & special effects"	"Heard good review/recommendations by family/friends,Good cast/actors,Like the writing/dialog,Good visuals/graphics/special effects,,,"
Not sure	"Don't know,,,,,,"
Very funny	"Witty/humorous/funny/entertaining,,,,,,"
Its a good show because it allows you to see what could be.	"Good/like the show/everything,Futuristic,,,,,"
i like to imagine how our progress is inevitably our destruction	"Science fiction/fantasy,Other realistic/association with real life mentions,,,,,"
it is very futirwitic to me and an escape	"Futuristic,Other misc. mentions,,,,,"
the evolution of humans and robots and how we are becoming so intertwined	"Technology involvement/overpowering human life,,,,,,"
I am a big fan of the science fiction genre and Westworld has great acting and graphics	"Science fiction/fantasy,Good acting,Good visuals/graphics/special effects,,,,"
"The series delves deep into the ethics of artificial intelligence,I like it for that"	"Technological aspects (inclusion of robots, exploring AI, etc.),,,,,,"
bring more actresses	"All negative mentions,,,,,,"
It makes me happy when I watch it	"Witty/humorous/funny/entertaining,,,,,,"
"I've been hooked since the beginning of season 1. The show is mesmerizing, outstanding cast, acting and writing. Just love it. I've not yet watched season 3 it's on my DVR but plan to start it very soon."	"Good/like the show/everything,Good cast/actors,Good acting,Like the writing/dialog,Have not watched enough to comment/not familiar with the show,,"
"It continues a narrativre and how AI is evolving into ""real"" peoplw"	"Other realistic/association with real life mentions,,,,,,"
The science fiction aspect of it and how it’s based on an older movie. I also think it being on HBO is a plus because it is not as limited as it would be on a cable network like ABC	"Science fiction/fantasy,Other misc. mentions,Aired on HBO,,,,"
