Input sentence,YAKE Prediction,YAKE Prediction Cleaned,TEXT_RANK Prediction,TEXT_RANK Prediction cleaned,Target Prediction
The artificial intelligence aspect,artificial intelligence aspect/intelligence aspect/artificial intelligence/aspect/artificial,artificial intelligence aspect,intelligence,intelligence,"Technological aspects (inclusion of robots, exploring AI, etc.),,,,,,"
The well-known actors and the overall plot. The futuristic elements make it all the more exciting.,known actors/overall plot/futuristic elements make/well/known,known actors/overall plot/futuristic elements make/well,overall plot/futuristic,overall plot/futuristic,"Good cast/actors,Good storyline/subject matter,Futuristic,Exciting,,,"
I like how it's a creepy amusement park and only certain people can get in.,creepy amusement park/creepy amusement/amusement park/certain people/like,creepy amusement park/certain people/like,amusement/certain,amusement/certain,"Like the concept/idea of futuristic amusement park,,,,,,"
the characters and actors,actors/characters and actors/characters,characters and actors,characters,characters,"Appealing characters/I like the characters,Good cast/actors,,,,,"
The mystery surrounding the storyline,mystery surrounding/storyline/surrounding the storyline/mystery/surrounding,mystery surrounding/surrounding the storyline,mystery,mystery,"Suspense/Mystery/thrillers,,,,,,"
I have always loved robot shows and the grittiness like game of thrones is what keeps me watching. The nudity could be increased tastefully and *&@!# scenes would be favorable. Longer seasons are also something I want.,always loved robot/loved robot shows/grittiness like game/always loved/loved robot,always loved robot/loved robot shows/grittiness like game,# scenes/robot shows/longer,# scenes/robot shows/longer,"Technological aspects (inclusion of robots, exploring AI, etc.),Other misc. mentions,,,,,"
the spirits are getting more exciting and intense,intense/exciting and intense/spirits/getting/exciting,exciting and intense/spirits/getting,spirits,spirits,"Exciting,Intense/serious,,,,,"
Westworld draws me by being futuristic and thought provoking. This show has taken the sci-fi genre to another level of entertainment which I enjoy.,westworld draws/thought provoking/westworld/provoking/draws,westworld draws/thought provoking,fi genre/futuristic/westworld,fi genre/futuristic/westworld,"Futuristic,Thought provoking,Science fiction/fantasy,Witty/humorous/funny/entertaining,,,"
The interesting plot,interesting plot/plot/interesting,interesting plot,interesting,interesting,"Good storyline/subject matter,,,,,,"
everything really,everything really/everything/really,everything really,,,"Good/like the show/everything,,,,,,"
The main story line. It's interesting.,main story line/story line/main story/interesting/line,main story line/interesting,main story,main story,"Good storyline/subject matter,,,,,,"
good,good,good,,,"Good/like the show/everything,,,,,,"
It is interesting and the the story lines keep me curious.,story lines keep/story lines/lines keep/curious/story,story lines keep/curious,story lines,story lines,"Interesting/engaging,Good storyline/subject matter,Attention grabbing/holds interest/keeps you wanting to watch more,,,,"
good,good,good,,,"Good/like the show/everything,,,,,,"
I like when there are twists in a show I do not see coming. Westworld always has many of these.,see coming/coming/westworld always/like/twists,see coming/westworld always/like/twists,show/twists,show/twists,"Suspense/Mystery/thrillers,,,,,,"
"I always seem to be confused and yet it draws me back in, because I want answers. It’s inviting because you hope something will get answered in the next episode, which maybe only 25% of your questions get answered, but it still keeps me coming back.",want answers/always seem/answers/get answered/questions get answered,want answers/always seem/questions get answered,next episode/confused,next episode/confused,"Attention grabbing/holds interest/keeps you wanting to watch more,,,,,,"
Character arch,character arch/character/arch,character arch,character,character,"Appealing characters/I like the characters,,,,,,"
The idea of a park where people can let their darker side loose without fear of consequences. It was an interesting look into the human psyche to see what lies just below the surface.,darker side loose/side loose without/loose without fear/darker side/side loose,darker side loose/side loose without/loose without fear,darker side/human psyche/interesting look,darker side/human psyche/interesting look,"Like the concept/idea of futuristic amusement park,Technology involvement/overpowering human life,,,,,"
I love sci fi in general but I really liked the whole robot part. I think robots are still something that’s interesting and it brings up questions of whether or not it’s ok to be a bad person just because you think somethings not human. I love the drama overall and the characters working together.,love sci/whole robot part/general/sci/robot part,love sci/whole robot part/general,whole robot/drama overall/bad person/sci fi,whole robot/drama overall/bad person/sci fi,"Science fiction/fantasy,Technological aspects (inclusion of robots, exploring AI, etc.),Like the drama,Other characters mentions,,,"
The storyline really keeps me wanting to see what happens next,storyline really keeps/happens next/storyline really/really keeps/next,storyline really keeps/happens next,,,"Good storyline/subject matter,Attention grabbing/holds interest/keeps you wanting to watch more,,,,,"
"Everything about it, the whole concept",whole concept/everything/concept/whole,whole concept/everything,whole,whole,"Good/like the show/everything,Like the concept/idea of futuristic amusement park,,,,,"
I like the Sci Fi genre and the focus on futuristic elements. It is a unique plot with unique futuristic possibilities that could exist in real life.,futuristic elements/sci/elements/sci fi genre/like the sci,futuristic elements/sci fi genre/like the sci,unique futuristic/real life/futuristic/fi/unique,unique futuristic/real life/fi,"Science fiction/fantasy,Futuristic,Unique/different,Like the premise/setting/scenery,,,"
"Everything was perfect, I think",everything/perfect/think/everything was perfect,think/everything was perfect,,,"Good/like the show/everything,,,,,,"
The acting is superb. Storyline is complex and intriguing. Shows keeps me guessing what will happen next.,superb/acting is superb/acting/shows keeps/happen next,acting is superb/shows keeps/happen next,storyline/superb/acting,storyline/superb/acting,"Good acting,Complex storyline,Interesting/engaging,Suspense/Mystery/thrillers,,,"
The futuristic aspect of the show is very interesting. The different twists they have added is also interesting. I hope they reopen the park.,futuristic aspect/also interesting/interesting/futuristic/aspect,futuristic aspect/also interesting,futuristic aspect/different,futuristic aspect/different,"Futuristic,Suspense/Mystery/thrillers,Like the concept/idea of futuristic amusement park,,,,"
The futuristic style and the dialogue in the show is very appealing to and makes me very interested to watch more. I think this combined with the number of talented actors makes this a good show.,futuristic style/talented actors makes/actors makes/good show/show,futuristic style/talented actors makes/good show,talented actors/futuristic style/show,talented actors/futuristic style/show,"Futuristic,Like the writing/dialog,Attention grabbing/holds interest/keeps you wanting to watch more,Good cast/actors,Good/like the show/everything,,"
the girls are hot,hot/girls are hot/girls,girls are hot,girls,girls,"Good cast/actors,,,,,,"
The whole thing is intrigue built on top of itself in a fascinating way.,fascinating way/whole thing/intrigue built/way/whole,fascinating way/whole thing/intrigue built,whole thing/fascinating,whole thing/fascinating,"Good/like the show/everything,,,,,,"
i into this show is so good,good/show,good/show,show,show,"Good/like the show/everything,,,,,,"
"The way it relates to issues today, but still is fantasy. The story, writing and acting are incredible.",issues today/today/fantasy/still is fantasy/way,issues today/still is fantasy/way,issues today/fantasy/way,issues today/fantasy/way,"Relevant to 21st century/existing in the world today/reflects our current society,Science fiction/fantasy,Good storyline/subject matter,Like the writing/dialog,Good acting,,"
great quality each episode is good whit some boring scene but excellent,great quality/good whit/boring scene/great/excellent,great quality/good whit/boring scene/excellent,good whit/great quality,good whit/great quality,"High quality show/high production values,Good/like the show/everything,,,,,"
"The acting and storylines are great, the plot is new.",great/new/storylines are great/plot is new/acting,storylines are great/plot is new/acting,storylines/acting,storylines/acting,"Good acting,Good storyline/subject matter,Unique/different,,,,"
make the plot clearer,plot clearer/make/clearer/make the plot/plot,plot clearer/make the plot,plot,plot,"All negative mentions,,,,,,"
THIS SHOW CONCEPT VERY EXCILENT,show concept/concept/show/excilent,show concept/excilent,show,show,"Like the concept/idea of futuristic amusement park,,,,,,"
It is a cool show,cool show/show/cool,cool show,cool,cool,"Good/like the show/everything,,,,,,"
I'm fascinated with artificial intelligence and I love the actors,artificial intelligence/fascinated/actors/fascinated with artificial/love the actors,artificial intelligence/fascinated with artificial/love the actors,artificial,artificial,"Technological aspects (inclusion of robots, exploring AI, etc.),Good cast/actors,,,,,"
"in the beginning it was new and different, and kept you guessing as to what was going to happen, and who was going to show up where. Then it became predictable, as if the writers had run out of ideas for the plot",going/different/happen/became predictable/going to happen,different/became predictable/going to happen,different/new/beginning,different/new/beginning,"Unique/different,Attention grabbing/holds interest/keeps you wanting to watch more,,,,,"
Storyline,storyline,storyline,,,"Good storyline/subject matter,,,,,,"
my husband made me watch this shows and my first impressions i dont like it until my husband keep watching it until i understand the story and it was cool very exciting movie,husband keep watching/exciting movie/first impressions/keep watching/husband made,husband keep watching/exciting movie/first impressions/husband made,first impressions/exciting,first impressions/exciting,"Good/like the show/everything,Exciting,,,,,"
"It is fun, entertaining and full of interesting events",interesting events/fun/entertaining/events/entertaining and full,interesting events/fun/entertaining and full,interesting events,interesting events,"Witty/humorous/funny/entertaining,Interesting/engaging,,,,,"
"Great acting across the board, but Aaron Paul is the best it’s one his best roles",aaron paul/great acting across/great acting/acting across/aaron,aaron paul/great acting across,great acting/aaron,great acting/aaron,"Good acting,Like Aaron Paul,,,,,"
Los robots de un parque de diversiones futurista basado en el Salvaje Oeste enloquecen y se convierten en una amenaza para los visitantes.,salvaje oeste enloquecen/salvaje oeste/diversiones futurista basado/oeste enloquecen/diversiones futurista,salvaje oeste enloquecen/diversiones futurista basado,salvaje oeste enloquecen y/de diversiones futurista/de/los/se,salvaje oeste enloquecen y/de diversiones futurista/los/se,"All negative mentions,,,,,,"
has character interesting and good brand,good brand/character interesting/brand/character/interesting,good brand/character interesting,character interesting,character interesting,"Appealing characters/I like the characters,,,,,,"
new story line,new story line/new story/story line/new/line,new story line,story,story,"Unique/different,,,,,,"
im drawn into the characters and i wanna see how this plays out,wanna see/drawn/characters/wanna/see,wanna see/drawn/characters,characters,characters,"Appealing characters/I like the characters,,,,,,"
Cast overall,cast overall/cast/overall,cast overall,,,"Good cast/actors,,,,,,"
The futuristic aspect,futuristic aspect/aspect/futuristic,futuristic aspect,futuristic,futuristic,"Futuristic,,,,,,"
The characters,characters,characters,,,"Appealing characters/I like the characters,,,,,,"
the story line and the actors the 1st season was great,story line/1st season/great/season was great/story,story line/1st season/season was great,story line/1st,story line/1st,"Good storyline/subject matter,Good cast/actors,Good experience/liked the previous seasons,,,,"
The adventure and anticipation keeps me hanging on.,anticipation keeps/adventure/anticipation/keeps/hanging,anticipation keeps/adventure/hanging,adventure,adventure,"Like the action/adventurous,Science fiction/fantasy,Attention grabbing/holds interest/keeps you wanting to watch more,,,,"
The imagination becoming reality is pretty cool. The sci-fi aspect of the the show is trilling.,imagination becoming reality/pretty cool/imagination becoming/becoming reality/cool,imagination becoming reality/pretty cool,fi aspect/imagination,fi aspect/imagination,"Science fiction/fantasy,Suspense/Mystery/thrillers,,,,,"
all the cast members and the plot and how twisted it is.,cast members/cast/members/plot/twisted,cast members/plot/twisted,cast members,cast members,"Good cast/actors,Like the premise/setting/scenery,Suspense/Mystery/thrillers,,,,"
"I just love all the complex twist in the story, it keep me watching",complex twist/story/watching/keep me watching/love,complex twist/story/keep me watching/love,complex,complex,"Suspense/Mystery/thrillers,Attention grabbing/holds interest/keeps you wanting to watch more,,,,,"
"I think the show is fantastic because it is unique in its storytelling, has compelling characters, features a diverse, talented cast, and is in high in production quality. I enjoy watching each week to catch up on the mysteries and trying to make guesses about twists and what's going to happen. I can never quite predict everything going on and that's part of the fun, getting to be surprised and engaged every week.",talented cast/compelling characters/production quality/storytelling/characters,talented cast/compelling characters/production quality/storytelling,production quality/talented cast/compelling characters/unique/fantastic,production quality/talented cast/compelling characters/unique/fantastic,"Good/like the show/everything,Unique/different,Good storyline/subject matter,Appealing characters/I like the characters,Good cast/actors,High quality show/high production values,Attention grabbing/holds interest/keeps you wanting to watch more"
it is a high energy show,high energy show/energy show/high energy/show/high,high energy show,energy,energy,"Intense/serious,,,,,,"
HBO high quality direction and overall production.,hbo high quality/hbo high/high quality direction/overall production/hbo,hbo high quality/high quality direction/overall production,high quality/overall,high quality/overall,"Other acting mentions,High quality show/high production values,,,,,"
The use of innovation technology and the overall cast of actors and the storyline is interesting that keeps you on the edge of your seat.,innovation technology/overall cast/seat/use/innovation,innovation technology/overall cast/seat/use,overall cast/innovation technology/use,overall cast/innovation technology/use,"Technological aspects (inclusion of robots, exploring AI, etc.),Good cast/actors,Good storyline/subject matter,Attention grabbing/holds interest/keeps you wanting to watch more,,,"
great things her erugtnow ove ryjerer,erugtnow ove ryjerer/great things/ove ryjerer/erugtnow ove/great,erugtnow ove ryjerer/great things,great,great,"None/no answer,,,,,,"
"The characters, Ed Harris, and Aron Paul",aron paul/harris/paul/aron/characters,aron paul/harris/characters,ed harris,ed harris,"Appealing characters/I like the characters,Like Ed Harris,Like Aaron Paul,,,,"
The cast and the plots,plots/cast,plots/cast,cast,cast,"Good cast/actors,Good storyline/subject matter,,,,,"
"intelligent dialogue and plot direction, superior acting, beautiful cinematography",superior acting/beautiful cinematography/intelligent dialogue/plot direction/intelligent,superior acting/beautiful cinematography/intelligent dialogue/plot direction,plot direction/intelligent dialogue,plot direction/intelligent dialogue,"Like the writing/dialog,Like the premise/setting/scenery,Good acting,Good visuals/graphics/special effects,,,"
I love the concept,concept/love the concept/love,love the concept,,,"Like the concept/idea of futuristic amusement park,,,,,,"
great,great,great,,,"Good/like the show/everything,,,,,,"
the backstory and the evolution of the characters,characters/backstory/evolution,characters/backstory/evolution,backstory,backstory,"Good storyline/subject matter,Like the characters development,,,,,"
remember the original movie so it is fun,original movie/remember/fun/remember the original/original,original movie/fun/remember the original,original,original,"Already seen/like the original movie,Witty/humorous/funny/entertaining,,,,,"
The beauty of Evan Rachel Wood. Her character and looks are mezmorizing.,evan rachel wood/rachel wood/evan rachel/wood/evan,evan rachel wood,evan rachel,evan rachel,"Like Evan Rachel Wood,Appealing characters/I like the characters,,,,,"
I liked this all time,time/liked,time/liked,,,"Good/like the show/everything,,,,,,"
So unique,unique,unique,,,"Unique/different,,,,,,"
Nothing,nothing,nothing,,,"None/no answer,,,,,,"
characters and concept,characters/concept/characters and concept,characters and concept,characters,characters,"Appealing characters/I like the characters,Like the concept/idea of futuristic amusement park,,,,,"
it is different than other shows that are on in a good way,good way/way/different/shows/good,good way/different/shows,other shows,other shows,"Unique/different,,,,,,"
Has some of my favorite actors. It's a great show cause it is unique in its settings and storylines. It's different from other shows.,favorite actors/great show cause/actors/favorite/great show,favorite actors/great show cause,great show/favorite actors/other,great show/favorite actors/other,"Good cast/actors,Good/like the show/everything,Unique/different,Like the premise/setting/scenery,Good storyline/subject matter,,"
The concepts of AI and personal identity it explores,personal identity/explores/identity it explores/concepts/personal,personal identity/identity it explores/concepts,personal identity,personal identity,"Technological aspects (inclusion of robots, exploring AI, etc.),,,,,,"
The novel concept of the show.,novel concept/show/novel/concept,novel concept/show,novel,novel,"Unique/different,,,,,,"
"Makes us think, makes your imagination wander",imagination wander/makes/think/wander/makes us think,imagination wander/makes us think,,,"Thought provoking,Science fiction/fantasy,,,,,"
Everything. I can’t pick just one. Seriously love this show,everything/pick/one/seriously/show,everything/pick/one/seriously/show,,,"Good/like the show/everything,,,,,,"
I think it's interesting how the AI become so real and adapt and change to be like real people. It really makes you think.,like real people/real people/like real/interesting/people,like real people/interesting,real people/real,real people,"Interesting/engaging,Technology involvement/overpowering human life,Thought provoking,,,,"
The movie and book it is based on.,movie/book/based/movie and book,based/movie and book,movie,movie,"Other misc. mentions,,,,,,"
I don't like the sci-fi ness of it. So I don't plan to watch anymore,like/sci/like the sci/watch anymore/ness,like the sci/watch anymore/ness,fi,fi,"All negative mentions,,,,,,"
season 1 was poor. I lost all interest in this show from that point. I won't be watching anymore,season/poor/watching anymore/point/anymore,season/poor/watching anymore/point,poor/season,poor/season,"All negative mentions,,,,,,"
This show has nothing that I would be interested in,show/nothing/would/interested/show has nothing,would/interested/show has nothing,show,show,"All negative mentions,,,,,,"
Very addicting,addicting,addicting,,,"Attention grabbing/holds interest/keeps you wanting to watch more,,,,,,"
"Love the AI, becoming aware, aspect. Seems like plausible view of our future.",becoming aware/aspect/love/becoming/aware,becoming aware/aspect/love,plausible view/ai,plausible view/ai,"Technological aspects (inclusion of robots, exploring AI, etc.),Futuristic,,,,,"
I really like that now that Dolores is outside the park shes replacing people with duplicates with the pearls she took from the park. it adds a sense of tension to the show you don't know who to trust,really like/replacing people/people with duplicates/park/dolores,really like/replacing people/people with duplicates/park/dolores,duplicates/people/park/dolores,duplicates/people/park/dolores,"Like the character Dolores Abernathy,Other realistic/association with real life mentions,,,,,"
I love the show,show/love the show/love,love the show,,,"Good/like the show/everything,,,,,,"
good so,good,good,,,"Good/like the show/everything,,,,,,"
I love everything about it. I like that it twists I love the actors and characters. My fiance likes it so we can watch it together. I like that it has many different sets not just in one place.,love everything/love/everything/like/fiance likes,love everything/fiance likes,many different sets,many different sets,"Good/like the show/everything,Suspense/Mystery/thrillers,Good cast/actors,Appealing characters/I like the characters,Can watch with family/family likes the show,Like the premise/setting/scenery,"
everything the whole element of the story,whole element/everything/story/everything the whole/whole,whole element/story/everything the whole,whole,whole,"Good/like the show/everything,Good storyline/subject matter,,,,,"
It is like unraveling a puzzle,like unraveling/puzzle/like/unraveling,like unraveling/puzzle,,,"Suspense/Mystery/thrillers,,,,,,"
The great story,great story/story/great,great story,great,great,"Good storyline/subject matter,,,,,,"
I am interested in the artificial intelligence aspect and the complex storylines.,artificial intelligence aspect/complex storylines/artificial intelligence/intelligence aspect/storylines,artificial intelligence aspect/complex storylines,complex storylines/intelligence,complex storylines/intelligence,"Technological aspects (inclusion of robots, exploring AI, etc.),Complex storyline,,,,,"
"Wonderful sets, interesting storyline, surprises",wonderful sets/interesting storyline/surprises/wonderful/sets,wonderful sets/interesting storyline/surprises,wonderful sets,wonderful sets,"Like the premise/setting/scenery,Good storyline/subject matter,Suspense/Mystery/thrillers,,,,"
It seems relevant to current events. What drew me to want to watch the show was how many people are talking about it,current events/seems relevant/events/seems/relevant,current events/seems relevant,current events/many,current events/many,"Relevant to 21st century/existing in the world today/reflects our current society,Heard good review/recommendations by family/friends,,,,,"
It is interesting and has twists and turns,turns/twists and turns/interesting/twists,twists and turns/interesting,interesting,interesting,"Interesting/engaging,Suspense/Mystery/thrillers,,,,,"
It's an interesting show,interesting show/show/interesting,interesting show,interesting,interesting,"Interesting/engaging,,,,,,"
It’s addicting,addicting,addicting,,,"Attention grabbing/holds interest/keeps you wanting to watch more,,,,,,"
The themes are interesting and thought provoking.,thought provoking/provoking/themes/interesting/thought,thought provoking/themes/interesting,themes,themes,"Interesting/engaging,Thought provoking,,,,,"
I like sci-fi shows,like sci/sci/shows/like,like sci/shows,fi,fi,"Science fiction/fantasy,,,,,,"
Great acting,great acting/great/acting,great acting,great,great,"Good acting,,,,,,"
Special effects,special effects/special/effects,special effects,special,special,"Good visuals/graphics/special effects,,,,,,"
The acting the sets and the story,acting the sets/story/acting/sets,acting the sets/story,sets,sets,"Good acting,Like the premise/setting/scenery,Good storyline/subject matter,,,,"
I would like to start from the beginning and watch all of them,would like/would/like/start/beginning,would like/start/beginning,,,"Good/like the show/everything,,,,,,"
Story acting and production.,story acting/story/production/acting and production/acting,story acting/acting and production,story,story,"Good storyline/subject matter,Good cast/actors,High quality show/high production values,,,,"
nothing,nothing,nothing,,,"None/no answer,,,,,,"
I like my futuristic it is and it's not like anything else that's on TV right now.,futuristic/like/like my futuristic/like anything/anything,like my futuristic/like anything,futuristic,futuristic,"Futuristic,Unique/different,,,,,"
THE STORIES AND CONCEPT OF THE SHOW IS UNIQUE,unique/show is unique/stories/concept/show,show is unique/stories/concept,stories,stories,"Good storyline/subject matter,Like the concept/idea of futuristic amusement park,Unique/different,,,,"
the storyline,storyline,storyline,,,"Good storyline/subject matter,,,,,,"
Nothing makes me want to watch it.,nothing makes/nothing/makes/want/watch,nothing makes/want/watch,,,"All negative mentions,,,,,,"
"everything, it is a so good serie, so different and interesting",good serie/everything/serie/interesting/different and interesting,good serie/everything/different and interesting,good serie,good serie,"Good/like the show/everything,Unique/different,Interesting/engaging,,,,"
