Input sentence,YAKE Prediction,YAKE Prediction Cleaned,TEXT_RANK Prediction,TEXT_RANK Prediction cleaned,Target Prediction
I enjoy the overall storyline.,overall storyline/storyline/enjoy/overall/enjoy the overall,overall storyline/enjoy the overall,overall,overall,"Good storyline/subject matter,,,,,,"
"I like the concept, it makes you think and the actors are top notch. The show just draws you in and keeps you interested.",top notch/concept/notch/like the concept/like,top notch/like the concept,top notch/concept,top notch/concept,"Like the concept/idea of futuristic amusement park,Thought provoking,Good cast/actors,Attention grabbing/holds interest/keeps you wanting to watch more,Interesting/engaging,,"
nothing,nothing,nothing,,,"None/no answer,,,,,,"
curious,curious,curious,,,"Interesting/engaging,,,,,,"
"I really like Sci-fi, and Westworld is a new way of the Sci-fi with a lot of dramas",really like sci/like sci/really like/new way/sci,really like sci/new way,new way/sci,new way/sci,"Science fiction/fantasy,Like the drama,,,,,"
Complex. Something different to watch.,complex/something different/something/watch/different,complex/something different/watch,complex,complex,"Complex storyline,Unique/different,,,,,"
The premise. The visuals and writing. The plot lines. The acting. I think it's the best show available right now.,premise/plot lines/writing/best show available/show available right,premise/plot lines/writing/best show available/show available right,best show/plot lines,best show/plot lines,"Good storyline/subject matter,Good visuals/graphics/special effects,Like the writing/dialog,Good/like the show/everything,,,"
it looks interesting to me,looks interesting/looks/interesting,looks interesting,,,"Interesting/engaging,,,,,,"
Dolores's revolution. Serac trying to make the world a better place. Caleb's relationship with Dolores. The technology portrayed on the show.,revolution/dolores/serac trying/better place/caleb,revolution/dolores/serac trying/better place/caleb,better place/serac/revolution/dolores,better place/serac/revolution/dolores,"Like the character Dolores Abernathy,Like the characters interaction,Technological aspects (inclusion of robots, exploring AI, etc.),,,,"
"This weeks episode of the HUGE reveal that DOLORES made multiple copies of herself and stuck them into all the others like HALE, etc... I suspected she was up to no good! “If you want things done right, do it yourself.”",others like hale/dolores made multiple/made multiple copies/like hale/huge reveal,others like hale/dolores made multiple/made multiple copies/huge reveal,multiple copies/weeks episode/huge,multiple copies/weeks episode/huge,"All negative mentions,,,,,,"
I just really love the concept of big tech becoming a monster and it's creations coming back to haunt them.,big tech becoming/really love/big tech/tech becoming/monster,big tech becoming/really love/monster,big tech,big tech,"Technological aspects (inclusion of robots, exploring AI, etc.),,,,,,"
There is nothing else like it on television. I really enjoyed the environments in seasons 1 and 2.,nothing else like/nothing else/else like/television/nothing,nothing else like/television,television,television,"Witty/humorous/funny/entertaining,,,,,,"
it is the hotest show of the year and all my friends and I watch it,hotest show/hotest/show/year/friends,hotest show/year/friends,hotest show,hotest show,"Good/like the show/everything,Can watch with family/family likes the show,,,,,"
great,great,great,,,"Good/like the show/everything,,,,,,"
no comment at this time.,time/comment,time/comment,comment,comment,"None/no answer,,,,,,"
Just an all around great sci-fi show!,around great sci/great sci/around great/sci/show,around great sci/show,great sci,great sci,"Science fiction/fantasy,,,,,,"
The visual effects. The futuristic scenes this season will draw me into more episodes.,visual effects/effects/visual/futuristic scenes/episodes,visual effects/futuristic scenes/episodes,visual effects/futuristic,visual effects/futuristic,"Good visuals/graphics/special effects,Futuristic,,,,,"
its great over all,great,great,,,"Good/like the show/everything,,,,,,"
sci-fi,sci,sci,sci,sci,"Science fiction/fantasy,,,,,,"
Evan Rachel wood,evan rachel wood/evan rachel/rachel wood/rachel/evan,evan rachel wood,rachel,rachel,"Like Evan Rachel Wood,,,,,,"
It is a good show that I enjoy. Smart and thrilling,good show/enjoy/good/show/smart,good show/enjoy/smart,good,good,"Good/like the show/everything,Suspense/Mystery/thrillers,Other show characteristic mentions,Witty/humorous/funny/entertaining,,,"
the storyline is very good,good/storyline,good/storyline,storyline,storyline,"Good storyline/subject matter,,,,,,"
"I am very much into sci fi and always have been since I was practically raised on it and this is one show fitting the mold of themes I like most that is available to me right now, I’m not too picky. Also if many people are watching it, and they are since it’s on hbo and easily accessible, it’s something we can all have in common.",one show fitting/practically raised/one show/show fitting/themes,one show fitting/practically raised/themes,many people/sci fi/mold/show,many people/sci fi/mold/show,"Science fiction/fantasy,Good/like the show/everything,Heard good review/recommendations by family/friends,Aired on HBO,,,"
Nothing,nothing,nothing,,,"None/no answer,,,,,,"
just how it's such a crazy thriller,crazy thriller/thriller/crazy,crazy thriller,crazy,crazy,"Suspense/Mystery/thrillers,,,,,,"
..... .... ... ...,None,None,,,"None/no answer,,,,,,"
It's different.,different,different,,,"Unique/different,,,,,,"
nothing at all is important enough to put here,important enough/nothing/important/enough/put,important enough/nothing/put,,,"All negative mentions,,,,,,"
I just enjoy the way the season plays out.,enjoy the way/season plays/enjoy/way/season,enjoy the way/season plays,way,way,"Good/like the show/everything,,,,,,"
Nothing,nothing,nothing,,,"None/no answer,,,,,,"
it is great,great,great,,,"Good/like the show/everything,,,,,,"
"I love attention to small details, the music is impeccable, so is the costume & set designs. This makes it more immersive for me personally.",set designs/small details/love attention/details/impeccable,set designs/small details/love attention/impeccable,set designs/small details,set designs/small details,"Informative/detailed,Like the music/song,Other misc. mentions,Like the premise/setting/scenery,Attention grabbing/holds interest/keeps you wanting to watch more,,"
I like the idea of the show and the great cast draws me in.,great cast draws/like the idea/great cast/cast draws/like,great cast draws/like the idea,great cast,great cast,"Like the concept/idea of futuristic amusement park,Good cast/actors,,,,,"
I like the creativeness of the show,like the creativeness/show/like/creativeness,like the creativeness/show,creativeness,creativeness,"Creative/innovative/modern,,,,,,"
I want to see the caat how they are work on it too. And as well what will the story end.,story end/want/see/caat/work,story end/want/see/caat/work,caat,caat,"Attention grabbing/holds interest/keeps you wanting to watch more,,,,,,"
It's a very exciting show that put you on your nervs,exciting show/nervs/exciting/show/put,exciting show/nervs/put,exciting,exciting,"Exciting,Attention grabbing/holds interest/keeps you wanting to watch more,,,,,"
Awesome charcter and story,awesome charcter/awesome/story/charcter and story/charcter,awesome charcter/charcter and story,awesome,awesome,"Appealing characters/I like the characters,Good storyline/subject matter,,,,,"
Because I believe that it is base on true advents that has happen in this world.,true advents/world/believe/base/true,true advents/world/believe/base,true advents,true advents,"Other realistic/association with real life mentions,,,,,,"
The whole premise,whole premise/premise/whole,whole premise,whole,whole,"Good storyline/subject matter,,,,,,"
Never sure what will happen next,never sure/happen next/never/next/sure,never sure/happen next,sure,sure,"Suspense/Mystery/thrillers,,,,,,"
All the drama and suspense,suspense/drama and suspense/drama,drama and suspense,drama,drama,"Like the drama,Suspense/Mystery/thrillers,,,,,"
that was good. i will like this more.,good/like,good/like,,,"Good/like the show/everything,,,,,,"
It's futuristic.,futuristic,futuristic,,,"Futuristic,,,,,,"
I have heard a lot of good news about it. The plot makes it good,good news/good/heard/lot/news,good news/heard/lot,good news/good,good news,"Heard good review/recommendations by family/friends,Like the premise/setting/scenery,,,,,"
how humanity is evolving into cyber experiences.,cyber experiences/experiences/humanity/evolving/cyber,cyber experiences/humanity/evolving,cyber,cyber,"Other realistic/association with real life mentions,,,,,,"
the action scenes and the different implementation of role,action scenes/different implementation/role/implementation of role/action,action scenes/different implementation/implementation of role,action scenes,action scenes,"Like the action/adventurous,Other characters mentions,,,,,"
It's like a thrilling rubix cube you get to watch come together. The rate in which you find out information with characters doesn't feel dumb downed for the sake of its viewers. The cast is amazing and you are always excited to see where they end up next or how they evolve.,watch come together/thrilling rubix cube/come together/thrilling rubix/rubix cube,watch come together/thrilling rubix cube,rubix cube/characters/information/rate,rubix cube/characters/information/rate,"Suspense/Mystery/thrillers,Attention grabbing/holds interest/keeps you wanting to watch more,Good cast/actors,Exciting,,,"
I really like the cast,really like/cast/like the cast/really/like,really like/like the cast,,,"Good cast/actors,,,,,,"
Nothing,nothing,nothing,,,"None/no answer,,,,,,"
I love the quality writing. HBO puts out quality work,quality writing/hbo puts/writing/hbo/quality work,quality writing/hbo puts/quality work,quality writing/quality,quality writing,"High quality show/high production values,Like the writing/dialog,,,,,"
I like that it is different from science fiction shows. It has a lot of drama and excitement.,science fiction shows/fiction shows/science fiction/shows/like,science fiction shows/like,science fiction shows,science fiction shows,"Unique/different,Like the drama,Exciting,,,,"
It's addicting and always keeps you guessing,always keeps/addicting/guessing/addicting and always/keeps you guessing,always keeps/addicting and always/keeps you guessing,,,"Attention grabbing/holds interest/keeps you wanting to watch more,Thought provoking,,,,,"
I liked the various worlds. THis season doesn't seem to have that.,various worlds/worlds/liked/various/seem,various worlds/liked/seem,various,various,"All negative mentions,,,,,,"
I loved the 1st two seasons plots and characters,1st two seasons/two seasons plots/1st two/two seasons/seasons plots,1st two seasons/two seasons plots,seasons plots,seasons plots,"Good experience/liked the previous seasons,Like the premise/setting/scenery,Appealing characters/I like the characters,,,,"
Constantly changing plots and twists...DELORES!!!,constantly changing plots/delores/constantly changing/changing plots/constantly,constantly changing plots/delores,plots,plots,"Suspense/Mystery/thrillers,Like the character Dolores Abernathy,,,,,"
What drives me in is the really crazy writing.,really crazy writing/crazy writing/really crazy/writing/drives,really crazy writing/drives,crazy,crazy,"Like the writing/dialog,,,,,,"
"It's a gripping, thought-provoking series that kept me entertained from the first scene to the end credits. And it has action, complex characters, amazing soundtrack, awesome visual effects, deep dialogs and impressive actors",provoking series/end credits/first scene/thought/awesome visual effects,provoking series/end credits/first scene/thought/awesome visual effects,amazing soundtrack/complex characters/end credits/first scene/visual,amazing soundtrack/complex characters/end credits/first scene/visual,"Attention grabbing/holds interest/keeps you wanting to watch more,Thought provoking,Witty/humorous/funny/entertaining,Like the action/adventurous,Like the character complexity,Like the music/song,Good visuals/graphics/special effects"
Storyline,storyline,storyline,,,"Good storyline/subject matter,,,,,,"
Love the graphics and the design of the series. The complex storyline and the futuristic artificial intelligence aspects.,love the graphics/artificial intelligence aspects/futuristic artificial intelligence/intelligence aspects/love,love the graphics/artificial intelligence aspects/futuristic artificial intelligence,artificial intelligence/complex storyline,artificial intelligence/complex storyline,"Good visuals/graphics/special effects,Other misc. mentions,Complex storyline,Futuristic,Technological aspects (inclusion of robots, exploring AI, etc.),,"
"the story line is great, the cast is exceptional and the twists and turns keep me coming back!",coming back/story line/turns keep/great/back,coming back/story line/turns keep/great,story line/great,story line/great,"Good storyline/subject matter,Good cast/actors,Suspense/Mystery/thrillers,,,,"
The concept of the show and the good acting,good acting/acting/concept/show/good,good acting/concept/show,good acting,good acting,"Like the concept/idea of futuristic amusement park,Good acting,,,,,"
interesting,interesting,interesting,,,"Interesting/engaging,,,,,,"
The dystopian and sci fi elements,elements/sci fi elements/dystopian/sci/dystopian and sci,sci fi elements/dystopian and sci,dystopian,dystopian,"Science fiction/fantasy,,,,,,"
The plot and acting talent really makes me want to continue to watch the show. Both aspects make this show appealing to watch and really interesting.,acting talent really/talent really makes/acting talent/want to continue/talent really,acting talent really/talent really makes/want to continue,talent/plot,talent/plot,"Good storyline/subject matter,Good acting,Attention grabbing/holds interest/keeps you wanting to watch more,Interesting/engaging,,,"
It’s unlike any other storyline,unlike/storyline,unlike/storyline,other,other,"Unique/different,,,,,,"
Characters and events,characters/events/characters and events,characters and events,characters,characters,"Appealing characters/I like the characters,Other misc. mentions,,,,,"
Everyone talks about it,everyone talks/everyone/talks,everyone talks,,,"Heard good review/recommendations by family/friends,,,,,,"
to me the show is confusing and hard to make sense..i don’t get it,make sense/sense/get/show/confusing,make sense/get/show/confusing,confusing/show,confusing/show,"All negative mentions,,,,,,"
Everything about the show. The storylines are completely different from anything else on tv.,everything/show/completely different/anything else/storylines,everything/show/completely different/anything else/storylines,storylines/show,storylines/show,"Good/like the show/everything,Good storyline/subject matter,Unique/different,,,,"
I like the transition from the original theme to the new plot,new plot/like the transition/original theme/plot/like,new plot/like the transition/original theme,original theme,original theme,"Other storyline/Plot mentions,,,,,,"
The special effects used for the show,special effects used/special effects/effects used/show/special,special effects used/show,special,special,"Good visuals/graphics/special effects,,,,,,"
N/A,None,None,n,n,"None/no answer,,,,,,"
"Science fiction, thriller, with artificial intelligence",science fiction/thriller/artificial intelligence/science/fiction,science fiction/thriller/artificial intelligence,science fiction,science fiction,"Science fiction/fantasy,Suspense/Mystery/thrillers,Technological aspects (inclusion of robots, exploring AI, etc.),,,,"
Nothing,nothing,nothing,,,"None/no answer,,,,,,"
It has a nice story.,nice story/story/nice,nice story,nice,nice,"Good storyline/subject matter,,,,,,"
The high quality program,high quality program/quality program/high quality/program/high,high quality program,quality,quality,"High quality show/high production values,,,,,,"
Seeing what happens next. Never sure how the story is going to progress.,happens next/seeing/next/seeing what happens/happens,happens next/seeing what happens,,,"Suspense/Mystery/thrillers,,,,,,"
It’s character driven with amazing sets and visuals.,character driven/amazing sets/character/visuals/sets and visuals,character driven/amazing sets/sets and visuals,amazing sets,amazing sets,"Appealing characters/I like the characters,Like the premise/setting/scenery,Good visuals/graphics/special effects,,,,"
Very good show to watch I really enjoy it,good show/really enjoy/good/show/watch,good show/really enjoy/watch,good,good,"Good/like the show/everything,Witty/humorous/funny/entertaining,,,,,"
I'm really not sure I've only watched it once,really/really not sure/sure/watched,really not sure/watched,,,"Have not watched enough to comment/not familiar with the show,,,,,,"
i dont know what to say but am really excited for this new season of this beloved show,beloved show/really excited/new season/show/know,beloved show/really excited/new season/know,new season,new season,"Exciting,,,,,,"
I think that because they have a futuristic and western setting at the same time it really keeps me watching,western setting/really keeps/watching/keeps me watching/think,western setting/really keeps/keeps me watching/think,western setting,western setting,"Futuristic,Western aspect,Attention grabbing/holds interest/keeps you wanting to watch more,,,,"
Just the reality warping type drama it brings.,reality warping type/warping type drama/reality warping/warping type/type drama,reality warping type/warping type drama,warping type,warping type,"Looks realistic,,,,,,"
You have any questions or would like to discuss this matter is greatly welcome in this matter as I have a very good time to work,would like/greatly welcome/good time/work/matter,would like/greatly welcome/good time/work/matter,good time,good time,"None/no answer,,,,,,"
cool,cool,cool,,,"Good/like the show/everything,,,,,,"
qwertyuijytrewertyuiujyhtgretyjghjgfedwrtyjh,qwertyuijytrewertyuiujyhtgretyjghjgfedwrtyjh,qwertyuijytrewertyuiujyhtgretyjghjgfedwrtyjh,,,"None/no answer,,,,,,"
N/A,None,None,n,n,"None/no answer,,,,,,"
"The character arc, particularly if Dolores and the man in back are very interesting. The show itself tackles interesting concepts in a new and different way",character arc/dolores/tackles interesting concepts/particularly if dolores/arc,character arc/tackles interesting concepts/particularly if dolores,interesting concepts/character arc/different/interesting,interesting concepts/character arc/different,"Like the character Dolores Abernathy,Like the concept/idea of futuristic amusement park,Unique/different,,,,"
Have only seen part of one episode so I have no opinion.,one episode/seen part/episode/seen/part,one episode/seen part,part,part,"Have not watched enough to comment/not familiar with the show,,,,,,"
"The writing, the story, the acting, the scenery are all impressively done. Love the genre",impressively done/writing/story/acting/done,impressively done/writing/story/acting,story/writing,story/writing,"Like the writing/dialog,Good acting,Like the premise/setting/scenery,Like the genre,,,"
Interesting,interesting,interesting,,,"Interesting/engaging,,,,,,"
It's a good kind of dark storytelling,dark storytelling/good kind/storytelling/good/kind,dark storytelling/good kind,good kind,good kind,"Good/like the show/everything,Dark/sarcastic,,,,,"
"You totally misunderstand. I’ve seen one episode, the first episode, a year or two ago. Write your survey better.",totally misunderstand/misunderstand/seen one episode/episode/totally,totally misunderstand/seen one episode,first episode/episode,first episode,"Have not watched enough to comment/not familiar with the show,,,,,,"
"The story line is different, but it is engaging. The characters are make the show exciting, yet it has a darkness to it. The privacy aspect of the show reflects how big ben is always lurking.",story line/different/engaging/show exciting/line is different,story line/engaging/show exciting/line is different,show exciting/story line/show/privacy,show exciting/story line/privacy,"Unique/different,Interesting/engaging,Appealing characters/I like the characters,Exciting,Other storyline/Plot mentions,,"
I like the drama,drama/like the drama/like,like the drama,,,"Like the drama,,,,,,"
I love the actors,actors/love the actors/love,love the actors,,,"Good cast/actors,,,,,,"
extermely,extermely,extermely,,,"Good/like the show/everything,,,,,,"
The artificial intelligence involved in the plot,artificial intelligence involved/artificial intelligence/intelligence involved/plot/artificial,artificial intelligence involved/plot,artificial,artificial,"Technological aspects (inclusion of robots, exploring AI, etc.),,,,,,"
Great show!,great show/great/show,great show,great,great,"Good/like the show/everything,,,,,,"
It’s very different from any other show,show/different,show/different,other,other,"Unique/different,,,,,,"
No NFL football to watch,nfl football/nfl/watch/football to watch/football,nfl football/football to watch,nfl,nfl,"Other misc. mentions,,,,,,"
waching this program makes me very motivated and can learn a lot,program makes/waching/lot/waching this program/program,program makes/lot/waching this program,program,program,"Other show characteristic mentions,,,,,,"
I love the nudity.,nudity/love the nudity/love,love the nudity,,,"Other storyline/Plot mentions,,,,,,"
"I like sci-fi and it is one of my favorite genres. Artificial Intelligence is also a main talking point at the moment, especially as we as a race move towards more machines and electronics. What makes it a good show is that it is engaging, well-written, has good plots, and knows how to keep the audience engaged.",like sci/sci/artificial intelligence/favorite genres/like,like sci/artificial intelligence/favorite genres,race move/artificial intelligence/favorite genres/good/talking,race move/artificial intelligence/favorite genres/good/talking,"Science fiction/fantasy,Like the genre,Technological aspects (inclusion of robots, exploring AI, etc.),Like the writing/dialog,Like the premise/setting/scenery,Interesting/engaging,"
the unusual sci-fi aspect,unusual sci/sci/aspect/unusual,unusual sci/aspect,unusual sci,unusual sci,"Suspense/Mystery/thrillers,Science fiction/fantasy,,,,,"
Season 2 was hard to follow...I don't know if I would do season 3 unless someone said that it was better,follow/hard to follow/season/hard/unless someone said,hard to follow/season/unless someone said,season,season,"All negative mentions,,,,,,"
Like futuristic element - but want to also keep loving characters from beginning. hard to follow at times. haven't started season 3 yet,like futuristic element/also keep loving/keep loving characters/like futuristic/futuristic element,like futuristic element/also keep loving/keep loving characters,futuristic element,futuristic element,"Futuristic,Appealing characters/I like the characters,,,,,"
because it is very good and i like it very much,good/much/like,good/much/like,,,"Good/like the show/everything,,,,,,"
my whole house sits together to watch,whole house sits/house sits together/whole house/house sits/sits together,whole house sits/house sits together,whole,whole,"Attention grabbing/holds interest/keeps you wanting to watch more,,,,,,"
nothing anymore. season 2 was too confusing,nothing anymore/nothing/anymore/season/confusing,nothing anymore/season/confusing,season,season,"All negative mentions,,,,,,"
The show is very surprising and there is nothing else like it,nothing else like/nothing else/else like/show/surprising,nothing else like/show/surprising,show,show,"Suspense/Mystery/thrillers,Unique/different,,,,,"
i like the artistic design behind the world that show lives in,artistic design behind/artistic design/design behind/show lives/like,artistic design behind/show lives/like,artistic,artistic,"Other High quality production values Mentions,,,,,,"
The continuous plot twists,continuous plot twists/plot twists/continuous plot/twists/continuous,continuous plot twists,plot,plot,"Suspense/Mystery/thrillers,,,,,,"
The futuristic nature of the show. The idea behind AI becoming more self aware and self directed. I like sci-fi. It can be a frustrating show to watch though as it is sometimes hard to follow.,futuristic nature/futuristic/nature/self directed/self,futuristic nature/self directed,frustrating show/futuristic nature/self/show,frustrating show/futuristic nature/self,"Futuristic,Like the concept/idea of futuristic amusement park,Technological aspects (inclusion of robots, exploring AI, etc.),Science fiction/fantasy,,,"
its amazing for me. its completely thrilling so its make a good show,good show/amazing/completely thrilling/show/completely,good show/amazing/completely thrilling,good,good,"Good/like the show/everything,Suspense/Mystery/thrillers,,,,,"
You never know what's going to happen from week to week. It's unpredictable.,never know/going/week/unpredictable/going to happen,never know/week/unpredictable/going to happen,week,week,"Suspense/Mystery/thrillers,,,,,,"
The setting of the show and plot twists,plot twists/twists/setting/show/plot,plot twists/setting/show,plot twists,plot twists,"Like the premise/setting/scenery,Suspense/Mystery/thrillers,,,,,"
well like i said ive only watched 1 and half shows.i didnt realize what all the ads ive sen what it was about until last week.now i know this is a must watch series,well like/well/watched/must watch series/like,well like/watched/must watch series,half shows.i/last,half shows.i/last,"Good/like the show/everything,,,,,,"
