Input sentence,YAKE Prediction,YAKE Prediction Cleaned,TEXT_RANK Prediction,TEXT_RANK Prediction cleaned,Target Prediction
different than other brands,different/brands,different/brands,other,other,"Unique/different,,,,,,"
fantasies through artificial consciousness.,artificial consciousness/fantasies/consciousness/fantasies through artificial/artificial,artificial consciousness/fantasies through artificial,artificial,artificial,"Science fiction/fantasy,Technological aspects (inclusion of robots, exploring AI, etc.),,,,,"
I can't wait to see how it unfolds,wait/unfolds/wait to see/see,unfolds/wait to see,,,"Attention grabbing/holds interest/keeps you wanting to watch more,,,,,,"
It sci fy stories and interesting plots it introduces,interesting plots/introduces/plots it introduces/sci/stories,interesting plots/plots it introduces/sci/stories,fy/interesting,fy/interesting,"Science fiction/fantasy,Interesting/engaging,Like the premise/setting/scenery,,,,"
The first season was excellent overall,excellent overall/first season/overall/first/season,excellent overall/first season,first,first,"Good experience/liked the previous seasons,,,,,,"
The characters themselves and the plot of the show draw me in every time a new episode airs.,new episode airs/episode airs/show draw/every time/new episode,new episode airs/show draw/every time,new episode airs,new episode airs,"Appealing characters/I like the characters,Good storyline/subject matter,Attention grabbing/holds interest/keeps you wanting to watch more,,,,"
Good writing and cast,good writing/good/cast/writing and cast/writing,good writing/writing and cast,good,good,"Like the writing/dialog,Good cast/actors,,,,,"
I think the charters are written in a venue and never on HBO. And has a good awards,hbo/never on hbo/good awards/think/charters,never on hbo/good awards/think/charters,good awards,good awards,"Appealing characters/I like the characters,Other misc. mentions,,,,,"
The fascination about how AI will evolve to challenge humanity,challenge humanity/humanity/fascination/evolve/challenge,challenge humanity/fascination/evolve,fascination,fascination,"Science fiction/fantasy,Technological aspects (inclusion of robots, exploring AI, etc.),,,,,"
"I need to get caught up on it, but just the sci fi aspect of it and artificial intelligence, and the idea of them having consciousness. It's very complicated but interesting.",artificial intelligence/get caught/intelligence/consciousness/need,artificial intelligence/get caught/consciousness/need,artificial intelligence/aspect/sci,artificial intelligence/aspect/sci,"Science fiction/fantasy,Technological aspects (inclusion of robots, exploring AI, etc.),Interesting/engaging,,,,"
Everything,everything,everything,,,"Good/like the show/everything,,,,,,"
The authenticity of the show is unmatched. It's very entertaining and modern yet colonial.,modern yet colonial/unmatched/show is unmatched/yet colonial/authenticity,modern yet colonial/show is unmatched/authenticity,unmatched/show/authenticity,unmatched/show/authenticity,"Original,Interesting/engaging,Creative/innovative/modern,,,,"
WESTWORLD is very excellent show and informative program,informative program/westworld/excellent show/program/excellent,informative program/westworld/excellent show,excellent show,excellent show,"Good/like the show/everything,Informative/detailed,,,,,"
Cast and creator of the show. Special effects. Futuristic outlook. Lots of action and adventure that keeps me wanting more.,cast/show/special effects/cast and creator/creator,show/special effects/cast and creator,futuristic outlook/special effects/cast,futuristic outlook/special effects/cast,"Good cast/actors,Other acting mentions,Good visuals/graphics/special effects,Futuristic,Like the action/adventurous,Attention grabbing/holds interest/keeps you wanting to watch more,"
Different story,different story/different/story,different story,different,different,"Unique/different,,,,,,"
"all it's good, i like it so much",good/much/like,good/much/like,,,"Good/like the show/everything,,,,,,"
Aron Paul and the story,aron paul/paul/aron/story,aron paul/story,aron,aron,"Like Aaron Paul,Good storyline/subject matter,,,,,"
Have something that will keep your eyes to the beginning and end of the show,show/something/keep/eyes/beginning,show/something/keep/eyes/beginning,beginning/eyes,beginning/eyes,"Attention grabbing/holds interest/keeps you wanting to watch more,,,,,,"
"hing, about Westworld draws you into this show and makes you want to watch? What makes it a good show? (Please be as detailed and com",westworld draws/hing/westworld/watch/show,westworld draws/hing/watch/show,good show/show/hing,good show/hing,"None/no answer,,,,,,"
I haven't kept up since the first season and I regret that.,first season/kept/kept up since/since/first,first season/kept up since,first,first,"Have not watched enough to comment/not familiar with the show,,,,,,"
Since I didn't watch much all I can say is the plot pretty good and its interesting with the character dynamic,plot pretty good/watch much/character dynamic/plot pretty/pretty good,plot pretty good/watch much/character dynamic,character dynamic,character dynamic,"Have not watched enough to comment/not familiar with the show,Good storyline/subject matter,Appealing characters/I like the characters,,,,"
The acting,acting,acting,,,"Good acting,,,,,,"
The futuristic role of technology and how it drives society,drives society/futuristic role/society/futuristic/role,drives society/futuristic role,futuristic role,futuristic role,"Futuristic,Technological aspects (inclusion of robots, exploring AI, etc.),,,,,"
THE NUDITY AND ORIGINAL MOVIE,original movie/movie/nudity/original/nudity and original,original movie/nudity and original,original,original,"Other storyline/Plot mentions,Already seen/like the original movie,,,,,"
Interesting story line with lots of twists. Plus an outstanding cast,interesting story line/interesting story/story line/interesting/twists,interesting story line/twists,outstanding cast/story,outstanding cast/story,"Interesting/engaging,Good storyline/subject matter,Suspense/Mystery/thrillers,Good cast/actors,,,"
I liked at first to confusing,confusing/first to confusing/liked/first/liked at first,first to confusing/liked at first,,,"All negative mentions,,,,,,"
Ed Harris character,harris character/harris/character,harris character,harris,harris,"Other characters mentions,,,,,,"
The acting,acting,acting,,,"Good acting,,,,,,"
Fantastic cinematography. Superb special effects. Terrific acting performances. Thought-provoking ideas.,fantastic cinematography/fantastic/cinematography/thought/superb special effects,fantastic cinematography/thought/superb special effects,superb special/fantastic cinematography,superb special/fantastic cinematography,"Good visuals/graphics/special effects,Good acting,Thought provoking,,,,"
The characters,characters,characters,,,"Appealing characters/I like the characters,,,,,,"
I love the themes and characters,characters/themes and characters/love/themes/love the themes,themes and characters/love the themes,themes,themes,"Good storyline/subject matter,Appealing characters/I like the characters,,,,,"
too confusing,confusing,confusing,,,"All negative mentions,,,,,,"
Nothing in particular,nothing/particular/nothing in particular,nothing in particular,,,"None/no answer,,,,,,"
the artificial intelligence aspect.,artificial intelligence aspect/intelligence aspect/artificial intelligence/aspect/artificial,artificial intelligence aspect,intelligence,intelligence,"Technological aspects (inclusion of robots, exploring AI, etc.),,,,,,"
it’s very different and creative and unique,different and creative/unique/creative and unique/different/creative,different and creative/creative and unique,different,different,"Unique/different,Creative/innovative/modern,,,,,"
The characters,characters,characters,,,"Appealing characters/I like the characters,,,,,,"
"Sci-fi nature of the show, Im not as interested in the show as much now. I've watched Season 1-2 but haven't picked it up for Season 3",sci/season/show/nature/watched season,sci/show/nature/watched season,fi nature/sci,fi nature/sci,"All negative mentions,,,,,,"
The writing is unlike the other shows available to watch on tv. I like complex shows that make you think,shows available/shows/writing/unlike/available,shows available/writing/unlike,other shows available/shows,other shows available,"Like the writing/dialog,Complex storyline,,,,,"
Characters and complexity,characters/complexity/characters and complexity,characters and complexity,characters,characters,"Appealing characters/I like the characters,Complex storyline,,,,,"
I am not sure,sure,sure,,,"Don't know,,,,,,"
I like all sci-fi movies so the fact it has that future vibe to it. I really like that stuff.,future vibe/sci/like/movies/fact,future vibe/sci/like/movies/fact,fi movies/future,fi movies/future,"Science fiction/fantasy,Futuristic,Good/like the show/everything,,,,"
it is ok,None,None,,,"Good/like the show/everything,,,,,,"
The suspense and the thrill,thrill/suspense,thrill/suspense,suspense,suspense,"Suspense/Mystery/thrillers,,,,,,"
"nothing like Ive seen before. Exciting, mind blowing, intense and attention getting.",nothing like/exciting/nothing/mind blowing/like,nothing like/exciting/mind blowing,mind blowing,mind blowing,"Unique/different,Exciting,Intense/serious,Attention grabbing/holds interest/keeps you wanting to watch more,,,"
"Well, I was a big fan of the movie. Yes, this show went in a completely different direction, but it is done very well.",big fan/well/movie/completely different direction/yes,big fan/well/movie/completely different direction/yes,big fan/different,big fan/different,"Already seen/like the original movie,Unique/different,Other storyline/Plot mentions,,,,"
story is good,story/good/story is good,story is good,story,story,"Good storyline/subject matter,,,,,,"
"I find that it is a very different take on AI as it pertains to movies/shows and I like the action, drama, and thrill.",different take/shows/movies/drama/pertains to movies,different take/shows/drama/pertains to movies,different take/movies/ai,different take/movies/ai,"Unique/different,Technological aspects (inclusion of robots, exploring AI, etc.),Like the action/adventurous,Like the drama,Suspense/Mystery/thrillers,,"
good,good,good,,,"Good/like the show/everything,,,,,,"
The show is a suburb twisting narrative where all details matter and the plot twists are meticulously planned and leave you questioning everyone. The details can be scrutinized over and over,suburb twisting narrative/questioning everyone/suburb twisting/twisting narrative/plot twists,suburb twisting narrative/questioning everyone/plot twists,details matter/twisting/details/plot,details matter/twisting/plot,"Suspense/Mystery/thrillers,Informative/detailed,Thought provoking,,,,"
its nice like him and very good not boring,nice like/boring/good not boring/nice/like,nice like/good not boring,nice,nice,"Good/like the show/everything,,,,,,"
trying to figure out how the story line evolves and the characters purpose is revelaed,story line evolves/story line/line evolves/characters purpose/trying,story line evolves/characters purpose/trying,characters purpose/line,characters purpose/line,"Suspense/Mystery/thrillers,Appealing characters/I like the characters,,,,,"
Nothing,nothing,nothing,,,"None/no answer,,,,,,"
NONE,none,none,,,"None/no answer,,,,,,"
It is visually stunning and very well produced. The actors are interesting and the effects are very real.,well produced/visually stunning/produced/visually/stunning,well produced/visually stunning,actors/stunning,actors/stunning,"Good visuals/graphics/special effects,High quality show/high production values,Good cast/actors,,,,"
"the story is great and the actors and characters are amazing. its a high quality show that is filmed with the quality of a movie, not like any regulat TV shows",amazing/high quality show/characters are amazing/story/great,high quality show/characters are amazing/story/great,high quality show/regulat tv/quality,high quality show/regulat tv,"Good storyline/subject matter,Good cast/actors,Appealing characters/I like the characters,High quality show/high production values,Unique/different,,"
"I love how complex and intricate the show is, with the plots within plots, and how in the end they all dovetail together for and overarching story line. I also love how intimate each of the character portrayals are, how they are 'more human' than we 'humans' seem to be at times. How it shows the darker side of humanity, but at the same time how we attempt to strive to be better too.",overarching story line/plots within plots/story line/plots within/within plots,overarching story line/plots within plots,overarching story line/same time/darker side/character portrayals,overarching story line/same time/darker side/character portrayals,"Complex storyline,Multiple story lines,Appealing characters/I like the characters,Other realistic/association with real life mentions,,,"
i really liked the original movie westworld so this is an extension of the original movie.,original movie westworld/original movie/really liked/movie westworld/original,original movie westworld/really liked,original movie,original movie,"Already seen/like the original movie,,,,,,"
BECAUSE MY FRIENDS AND I WATCH WESTWORLD TOGETHER,watch westworld together/westworld together/watch westworld/together/friends,watch westworld together/friends,my,my,"Can watch with family/family likes the show,,,,,,"
It has a good cast and writing and it explores a topic that no other show or movie is or has covered.,good cast/cast and writing/show or movie/covered/good,good cast/cast and writing/show or movie/covered,good cast/other,good cast/other,"Good cast/actors,Like the writing/dialog,Unique/different,,,,"
The cast just hits home with me. Love Jeffrey Wright and Evan Rachel Wood in particular. They are special talents.,evan rachel wood/love jeffrey wright/hits home/jeffrey wright/evan rachel,evan rachel wood/love jeffrey wright/hits home,jeffrey wright/rachel/special,jeffrey wright/rachel/special,"Good cast/actors,Other acting mentions,Like Evan Rachel Wood,Good acting,,,"
The sci fi genre,genre/sci fi genre/sci,sci fi genre,fi,fi,"Science fiction/fantasy,,,,,,"
"Evolving storyline, characters are complex. The concept of AI as a fantasy that is paid for like going to an amusement park",evolving storyline/evolving/storyline/characters/complex,evolving storyline/characters/complex,amusement park/characters/storyline,amusement park/characters/storyline,"Other storyline/Plot mentions,Like the character complexity,Technological aspects (inclusion of robots, exploring AI, etc.),,,,"
The outstanding scripts and cast makes it a show on the level of Game of Thrones,level of game/outstanding scripts/cast makes/thrones/game of thrones,level of game/outstanding scripts/cast makes/game of thrones,outstanding scripts/cast,outstanding scripts/cast,"Like the writing/dialog,Good cast/actors,Other misc. mentions,,,,"
interesting characters,interesting characters/interesting/characters,interesting characters,interesting,interesting,"Interesting/engaging,Appealing characters/I like the characters,,,,,"
The characters and the possibility of AI,characters/possibility,characters/possibility,characters,characters,"Appealing characters/I like the characters,Technological aspects (inclusion of robots, exploring AI, etc.),,,,,"
The excitement,excitement,excitement,,,"Exciting,,,,,,"
complex storyline,complex storyline/complex/storyline,complex storyline,complex,complex,"Complex storyline,,,,,,"
the intrique,intrique,intrique,,,"Interesting/engaging,,,,,,"
It is very edgy and interesting visually. The high definition imagery really showcases the effects so well. It is very immersive. I like the idea of machines learning as well.,interesting visually/visually/high definition imagery/definition imagery really/imagery really showcases,interesting visually/high definition imagery/definition imagery really/imagery really showcases,high definition imagery/edgy,high definition imagery/edgy,"Attention grabbing/holds interest/keeps you wanting to watch more,Interesting/engaging,Good visuals/graphics/special effects,Other misc. mentions,,,"
The futuristic aspect of it,futuristic aspect/futuristic/aspect,futuristic aspect,futuristic,futuristic,"Futuristic,,,,,,"
"It is unpredictable, it has great acting, the stories go in unexpected directions. I like the new direction of the show. It deals with privacy and data issues",great acting/unexpected directions/unpredictable/acting/directions,great acting/unexpected directions/unpredictable,new direction/unexpected directions/great acting,new direction/unexpected directions/great acting,"Suspense/Mystery/thrillers,Good acting,Unique/different,Technological aspects (inclusion of robots, exploring AI, etc.),,,"
Not much of anything better on tv,anything better/much/anything/better/much of anything,anything better/much of anything,much,much,"Good/like the show/everything,,,,,,"
It’s good sci-fi.,good sci/good/sci,good sci,good,good,"Science fiction/fantasy,,,,,,"
i find it intriguing and the wife likes it quite a bit; we watch the show together.,show together/wife likes/bit/together/find,show together/wife likes/bit/find,wife/intriguing,wife/intriguing,"Interesting/engaging,Can watch with family/family likes the show,,,,,"
I like the AI concept they had going on. It was really neat!,like/concept/going/really neat/neat,like/concept/going/really neat,ai,ai,"Technological aspects (inclusion of robots, exploring AI, etc.),,,,,,"
The constantly changing narratives of the characters. Plus I like violence and nudity.,constantly changing narratives/constantly changing/changing narratives/characters/constantly,constantly changing narratives/characters,characters/narratives,characters/narratives,"Suspense/Mystery/thrillers,Violence,Other storyline/Plot mentions,,,,"
"Its exciting, the plot twists are amazing and it is incredibly thought provoking. The idea that this is a possible future of the human race makes it even more interesting to watch.",incredibly thought provoking/thought provoking/plot twists/incredibly thought/human race makes,incredibly thought provoking/plot twists/human race makes,possible future/plot twists/human,possible future/plot twists/human,"Exciting,Suspense/Mystery/thrillers,Thought provoking,Futuristic,Attention grabbing/holds interest/keeps you wanting to watch more,,"
I like it so much,much/like,much/like,,,"Good/like the show/everything,,,,,,"
The whole idea of it is very interesting,whole idea/interesting/whole/idea,whole idea/interesting,whole,whole,"Like the concept/idea of futuristic amusement park,,,,,,"
Ruined a classic,ruined/classic,ruined/classic,,,"All negative mentions,,,,,,"
"futuristic, scary, interesting, thrilling, concept is amazing",futuristic/scary/interesting/thrilling/concept,futuristic/scary/interesting/thrilling/concept,interesting/scary/futuristic,interesting/scary/futuristic,"Futuristic,Other show characteristic mentions,Interesting/engaging,Suspense/Mystery/thrillers,Like the concept/idea of futuristic amusement park,,"
It has good acting & I like the sci-fi part of it,good acting/acting/sci/like the sci/good,good acting/like the sci,good acting,good acting,"Good acting,Science fiction/fantasy,,,,,"
I like how immersive everything gets,immersive everything gets/everything gets/immersive everything/gets/like,immersive everything gets/like,,,"Attention grabbing/holds interest/keeps you wanting to watch more,,,,,,"
"It reveting story with action,adventure,and twist that are such to entertain",adventure/reveting story/action/entertain/story with action,adventure/reveting story/entertain/story with action,action/story,action/story,"Good storyline/subject matter,Like the action/adventurous,Suspense/Mystery/thrillers,Witty/humorous/funny/entertaining,,,"
I really enjoy how deep and three dimensional the characters on the show are because to me this is a show where there really isn’t a clear villain and I find that fascinating.,clear villain/three dimensional/dimensional the characters/really enjoy/villain,clear villain/three dimensional/dimensional the characters/really enjoy,clear villain/deep,clear villain/deep,"Appealing characters/I like the characters,Thought provoking,Interesting/engaging,,,,"
The intrigue and the cast,cast/intrigue,cast/intrigue,intrigue,intrigue,"Interesting/engaging,Good cast/actors,,,,,"
I love the strange complexity of the show and what it offers,strange complexity/offers/love/strange/complexity,strange complexity/offers/love,strange,strange,"Complex storyline,,,,,,"
"I believe the way the manuscripts are written, the little details throughout the series that took myself for a surprise, and the characters personalities are what I believe that make it a good show.",little details throughout/good show/little details/details throughout/characters personalities,little details throughout/good show/characters personalities,characters personalities/little details/good,characters personalities/little details/good,"Like the writing/dialog,Informative/detailed,Like the characters development,Good/like the show/everything,,,"
I like the story line and the acting is very good,story line/good/like/story/line,story line/good/like,story line,story line,"Good storyline/subject matter,Good acting,,,,,"
I have never had a series draw me in so much.,series draw/much/never/series/draw,series draw/much/never,,,"Attention grabbing/holds interest/keeps you wanting to watch more,,,,,,"
I like the actors on the show.,like the actors/show/like/actors,like the actors/show,actors,actors,"Good cast/actors,,,,,,"
"I think it is better than the original, and I love all of the characters and how dark the show gets.",show gets/original/gets/think/better,show gets/original/think/better,original/better,original/better,"Good/like the show/everything,Appealing characters/I like the characters,Dark/sarcastic,,,,"
It is unique compared to other television shows. I like the science fiction element of the main story.,television shows/unique compared/shows/main story/science fiction element,television shows/unique compared/main story/science fiction element,main story/fiction/television,main story/fiction/television,"Unique/different,Science fiction/fantasy,,,,,"
the surprising of each episode,episode/surprising,episode/surprising,surprising,surprising,"Suspense/Mystery/thrillers,,,,,,"
yupy yup,yupy yup/yupy/yup,yupy yup,yupy,yupy,"None/no answer,,,,,,"
High quality TV,high quality/high/quality,high quality,quality,quality,"High quality show/high production values,,,,,,"
That I'm continually surprised by it for the most part.,continually surprised/continually/part/surprised,continually surprised/part,most,most,"Suspense/Mystery/thrillers,,,,,,"
The show is interested in has very good characters,good characters/characters/show/interested/good,good characters/show/interested,good characters,good characters,"Appealing characters/I like the characters,,,,,,"
it is a really good show to watch and has a very good storyliine,really good show/good storyliine/really good/good show/storyliine,really good show/good storyliine,good,good,"Good/like the show/everything,Good storyline/subject matter,,,,,"
it has a very interesting concept,interesting concept/concept/interesting,interesting concept,interesting,interesting,"Interesting/engaging,Like the concept/idea of futuristic amusement park,,,,,"
The script & acting,acting/script,acting/script,script,script,"Like the writing/dialog,Good acting,,,,,"
none,none,none,,,"None/no answer,,,,,,"
The storyline and the characters are very enjoyable,enjoyable/storyline/characters,enjoyable/storyline/characters,storyline,storyline,"Good storyline/subject matter,Appealing characters/I like the characters,,,,,"
"WESTWORLD is a sophisticated show with sophisticated performances, multi-layered acting, just very good and thought-provoking storytelling. It is a show that challenges, that surprises, that stimulates. Thandie Newton, Ed Harris and Jeffrey Wright are revelations. Evan Rachel Wood continues to be tremendous. The visual effects are cinematic. So is the production design and cinematography. Virtually everything is first-rate. WESTWORLD is appointment television, but these days we can decide when to go to that appointment, or set several appointments to accommodate viewing the whole season.",layered acting/provoking storytelling/sophisticated performances/sophisticated show/sophisticated,layered acting/provoking storytelling/sophisticated performances/sophisticated show,- layered/several appointments/appointment television/production design/visual effects,- layered/several appointments/appointment television/production design/visual effects,"Other show characteristic mentions,Good acting,Thought provoking,Suspense/Mystery/thrillers,Like the characters interaction,Like Evan Rachel Wood,Good visuals/graphics/special effects"
The storylines are great and I love the characters.,characters/love the characters/storylines/great/love,love the characters/storylines/great,storylines,storylines,"Good storyline/subject matter,Appealing characters/I like the characters,,,,,"
I am hoping for this season to finally make sense of the last two seasons,last two seasons/finally make sense/two seasons/finally make/make sense,last two seasons/finally make sense,sense/season,sense/season,"Other misc. mentions,,,,,,"
I would call all my friends over and watch it with them which would make it way more fun than usual.,would call/would make/usual/would/fun than usual,would call/would make/fun than usual,more fun,more fun,"Can watch with family/family likes the show,Unique/different,,,,,"
