Input sentence,YAKE Prediction,YAKE Prediction Cleaned,TEXT_RANK Prediction,TEXT_RANK Prediction cleaned,Target Prediction
.,None,None,,,"None/no answer,,,,,,"
yes,yes,yes,,,"None/no answer,,,,,,"
no,None,None,,,"None/no answer,,,,,,"
It is very interesting has a great cast and awesome storyline,awesome storyline/great cast/storyline/interesting/great,awesome storyline/great cast/interesting,great cast,great cast,"Interesting/engaging,Good cast/actors,Good storyline/subject matter,,,,"
Thandie Newton ‘nuff said.,thandie newton/nuff said/newton/thandie/nuff,thandie newton/nuff said,thandie,thandie,"Like Thandie Newton,,,,,,"
It doesn't. I don't watch it.,watch,watch,,,"All negative mentions,,,,,,"
Decent show,decent show/decent/show,decent show,decent,decent,"Good/like the show/everything,,,,,,"
The plot and the complexity of the show is amazing.,amazing/show is amazing/plot/complexity/show,show is amazing/plot/complexity,complexity/plot,complexity/plot,"Good storyline/subject matter,Complex storyline,,,,,"
I just like the futuristic storyline and the complex story and twists.,futuristic storyline/complex story/twists/story and twists/like,futuristic storyline/complex story/story and twists/like,futuristic storyline,futuristic storyline,"Futuristic,Complex storyline,Suspense/Mystery/thrillers,,,,"
?,None,None,,,"Don't know,,,,,,"
very good,good,good,,,"Good/like the show/everything,,,,,,"
Season one was original and unique. Reviews of seasons 2 and three say it's lost its way.,season one/season/unique/original and unique/one,season one/original and unique,unique/original/season,unique/original/season,"Original,Unique/different,,,,,"
I like that it's a way to go back and forth between words and also live how they main characters live without exists and other worldly beings and put of this world beings,main characters live/characters live without/live without exists/main characters/without exists,main characters live/characters live without/live without exists,worldly beings/main characters/beings,worldly beings/main characters,"Other storyline/Plot mentions,Other characters mentions,,,,,"
The writing is superb. Love watching the characters develop over time. The actors themselves are convincing in their roles.,superb/love watching/writing is superb/writing/characters develop,love watching/writing is superb/characters develop,characters/love/superb/writing,characters/love/superb/writing,"Like the writing/dialog,Appealing characters/I like the characters,Good cast/actors,,,,"
Everything!,everything,everything,,,"Good/like the show/everything,,,,,,"
"You feel like you're untangling a gigantic, complex knot that reveals new twists and turns with each layer that comes unraveled. It's engaging and riveting",reveals new twists/complex knot/comes unraveled/feel like/reveals new,reveals new twists/complex knot/comes unraveled/feel like,new twists/complex knot,new twists/complex knot,"Suspense/Mystery/thrillers,Interesting/engaging,,,,,"
I just like it,like,like,,,"Good/like the show/everything,,,,,,"
THERES REALLY NOTHING I WATCHED PARTS OF 3 EPISODES AND NEVER REALLY GOT INTO IT,theres really/theres/nothing/really/watched,theres really/nothing/watched,theres really/really/nothing,theres really/nothing,"All negative mentions,,,,,,"
"Westworld literally plays you. It plays you as assuredly as the skeletal fingers that dance across the piano keys in the title sequence. Each episode draws you in and seduces you with the promise of revelations, before flipping those expectations on their head and delivering something more interesting and finely crafted than you’d thought possible. Not only that, though, Westworld’s episodes subtly seed persistent narrative elements that coalesce when the show is ready to reveal its secrets to the viewer.",westworld literally plays/westworld literally/literally plays/westworld/plays,westworld literally plays,westworld ’s episodes/persistent narrative/title sequence/piano keys/skeletal fingers,westworld ’s episodes/persistent narrative/title sequence/piano keys/skeletal fingers,"Attention grabbing/holds interest/keeps you wanting to watch more,Interesting/engaging,Suspense/Mystery/thrillers,,,,"
i love the cast and the plots. the writers are great and keep me coming back for every single episode. i love it,every single episode/plots/love the cast/love/single episode,every single episode/plots/love the cast,single episode/cast,single episode/cast,"Good cast/actors,Like the premise/setting/scenery,Like the writing/dialog,Attention grabbing/holds interest/keeps you wanting to watch more,,,"
I watched the first two seasons,first two seasons/two seasons/first two/seasons/watched,first two seasons/watched,first,first,"Have not watched enough to comment/not familiar with the show,,,,,,"
i like very much,much/like very much/like,like very much,,,"Good/like the show/everything,,,,,,"
its very interesting,interesting,interesting,,,"Interesting/engaging,,,,,,"
i just thnik it is a really interesting and unique show,unique show/really interesting/show/thnik/really,unique show/really interesting/thnik,unique,unique,"Interesting/engaging,Unique/different,,,,,"
offers good service,offers good service/offers good/good service/offers/service,offers good service,good,good,"Other misc. mentions,,,,,,"
the actors and the diologe,diologe/actors,diologe/actors,actors,actors,"Good cast/actors,Like the writing/dialog,,,,,"
"I like the concept of it, it's very interesting and thought-provoking.",provoking/thought/interesting and thought/like/concept,provoking/interesting and thought/like/concept,concept,concept,"Like the concept/idea of futuristic amusement park,Interesting/engaging,Thought provoking,,,,"
I love the action and drama and thandie Newton's character,thandie newton/action and drama/character/newton/love,thandie newton/action and drama/character/love,thandie newton,thandie newton,"Like the action/adventurous,Like the drama,Other characters mentions,,,,"
The interesting sci fi western combination with good writing,good writing/interesting sci/western combination/writing/interesting,good writing/interesting sci/western combination,interesting sci/western,interesting sci/western,"Interesting/engaging,Science fiction/fantasy,Like the writing/dialog,,,,"
Exciting story line,exciting story line/exciting story/story line/exciting/line,exciting story line,story,story,"Exciting,Good storyline/subject matter,,,,,"
None,none,none,,,"None/no answer,,,,,,"
It is very furhurres,furhurres,furhurres,,,"Futuristic,,,,,,"
"I really love the cast as well as the overall storyline. It is so different than anything out right now, and it is so captivating.",overall storyline/really love/cast as well/storyline/really,overall storyline/really love/cast as well,overall storyline,overall storyline,"Good cast/actors,Good storyline/subject matter,Unique/different,Attention grabbing/holds interest/keeps you wanting to watch more,,,"
I just enjoy it,enjoy,enjoy,,,"Witty/humorous/funny/entertaining,,,,,,"
great,great,great,,,"Good/like the show/everything,,,,,,"
i really liked the movie and spreading beyond that and focuses on things that are relevant to today is exciting,really liked/spreading beyond/exciting/today is exciting/really,really liked/spreading beyond/today is exciting,things/movie,things/movie,"Already seen/like the original movie,Relevant to 21st century/existing in the world today/reflects our current society,,,,,"
very god eay teu more eys fn eys moge oddo,eys moge oddo/god eay teu/moge oddo/god eay/eay teu,eys moge oddo/god eay teu,eys moge/eay teu/eys,eys moge/eay teu,"None/no answer,,,,,,"
The action and the characters,characters/action,characters/action,action,action,"Like the action/adventurous,Appealing characters/I like the characters,,,,,"
it makes you be on the edge of your seat and keeps you guessing about what will happen,happen/makes/edge/seat/keeps,happen/makes/edge/seat/keeps,edge,edge,"Attention grabbing/holds interest/keeps you wanting to watch more,,,,,,"
The creative and beautiful story telling and environment,beautiful story telling/beautiful story/story telling/environment/telling and environment,beautiful story telling/telling and environment,beautiful story,beautiful story,"Creative/innovative/modern,Good storyline/subject matter,Other misc. mentions,,,,"
The concept and the aesthetic of the setting appeals to me,setting appeals/concept/aesthetic/setting/appeals,setting appeals/concept/aesthetic,concept,concept,"Like the concept/idea of futuristic amusement park,Like the premise/setting/scenery,,,,,"
New lines,new lines/new/lines,new lines,new,new,"Unique/different,,,,,,"
What makes it a good show is that it strings you along so easily that I can't not watch. It has a future that is very crazy to think about and that is what draws you in.,good show/watch/makes/good/show,good show/watch/makes,good show,good show,"Futuristic,Attention grabbing/holds interest/keeps you wanting to watch more,,,,,"
Interesting concepts and constant world changing,constant world changing/interesting concepts/world changing/constant world/interesting,constant world changing/interesting concepts,interesting concepts,interesting concepts,"Interesting/engaging,Like the concept/idea of futuristic amusement park,Other show type mentions,,,,"
overall this is a really great show nand i would say that it is one of the best shows that is currently in the market,really great show/great show nand/really great/great show/show nand,really great show/great show nand,best shows/show,best shows,"Good/like the show/everything,,,,,,"
"i think its a unique and original type of show, as well as that its futuristic",original type/show/futuristic/type of show/think,original type/futuristic/type of show/think,original type,original type,"Unique/different,Original,Futuristic,,,,"
The overall story and the actors involved.,actors involved/overall story/involved/overall/story,actors involved/overall story,overall,overall,"Good storyline/subject matter,Good cast/actors,,,,,"
each character feel like they could be the main character of the show,character feel like/feel like/character feel/main character/show,character feel like/main character/show,character,character,"Appealing characters/I like the characters,,,,,,"
It's a good ahow,good ahow/ahow/good,good ahow,good,good,"Good/like the show/everything,,,,,,"
It is more entertaining when talking about artificial intelligence between the ties of the characters,artificial intelligence/characters/entertaining/talking/artificial,artificial intelligence/characters/entertaining/talking,artificial intelligence,artificial intelligence,"Witty/humorous/funny/entertaining,Technological aspects (inclusion of robots, exploring AI, etc.),Like the characters development,,,,"
sci fi mixed with western and different cultures mixed in,different cultures mixed/different cultures/cultures mixed/sci/mixed,different cultures mixed/sci,different cultures/fi,different cultures/fi,"Science fiction/fantasy,Other storyline/Plot mentions,,,,,"
It’s fantastic show that I ever watch it.,fantastic show/ever watch/fantastic/show/ever,fantastic show/ever watch,fantastic,fantastic,"Good/like the show/everything,,,,,,"
the thrilling action,thrilling action/action/thrilling,thrilling action,thrilling,thrilling,"Like the action/adventurous,,,,,,"
vbfg,vbfg,vbfg,,,"None/no answer,,,,,,"
Futuristic elements that seem real because of the great character development,great character development/futuristic elements/character development/seem real/great character,great character development/futuristic elements/seem real,futuristic elements/character,futuristic elements/character,"Futuristic,Like the characters development,,,,,"
"It is a great series, it has a great special effect and the best written shows does it all at once. Westworld is very unique",best written shows/great special effect/great series/special effect/best written,best written shows/great special effect/great series,great special effect/great series,great special effect/great series,"Good/like the show/everything,Good visuals/graphics/special effects,Like the writing/dialog,Unique/different,,,"
"What makes it a good show is that it genuinely explores the cynical, violent relationship that humans have for others people, other things, and the desire to dehumanize all in the name of self-indulgence. I really enjoyed season 3 by how it goes beyond just the parks into almost replicant infiltration into our society.",violent relationship/others people/good show/genuinely explores/really enjoyed season,violent relationship/others people/good show/genuinely explores/really enjoyed season,other things/others people/violent relationship/good show/replicant,other things/others people/violent relationship/good show/replicant,"Other storyline/Plot mentions,Witty/humorous/funny/entertaining,Relevant to 21st century/existing in the world today/reflects our current society,,,,"
It’s just interesting eith nothing like it out their,interesting eith nothing/eith nothing like/interesting eith/eith nothing/nothing like,interesting eith nothing/eith nothing like,interesting,interesting,"Interesting/engaging,,,,,,"
the story of the show is great .that s why i like it very much,great/show is great/story/show/much,show is great/story/much,show/story,show/story,"Good storyline/subject matter,Good/like the show/everything,,,,,"
Husband likes it,husband likes/husband/likes,husband likes,,,"Good/like the show/everything,,,,,,"
great writing with complex characters,great writing/complex characters/great/characters/writing,great writing/complex characters,great writing,great writing,"Like the writing/dialog,Like the character complexity,,,,,"
I like the idea that westworld is a theme park and all the technology there is to give it that perfect touch of the old west. The theme of the hosts is very interesting,old west/perfect touch/theme park/west/theme,old west/perfect touch/theme park,perfect touch/theme park/theme/old,perfect touch/theme park/old,"Like the concept/idea of futuristic amusement park,Technological aspects (inclusion of robots, exploring AI, etc.),Other acting mentions,,,,"
"His good controversial story, where he causes empathy with his characters ad that makes him want to see more",good controversial story/controversial story/good controversial/causes empathy/story,good controversial story/causes empathy,characters ad/controversial,characters ad/controversial,"Other storyline/Plot mentions,Other characters mentions,,,,,"
nothing more than whats being done now,nothing/done,nothing/done,,,"Good/like the show/everything,,,,,,"
the sci fi and action,action/sci,action/sci,sci,sci,"Science fiction/fantasy,Like the action/adventurous,,,,,"
I don’t know,know,know,,,"Don't know,,,,,,"
Westworld is good because there is a lot of material to work with and is not a generic plot line. The cast and the writing make the show.,generic plot line/plot line/generic plot/westworld/line,generic plot line/westworld,generic plot line/good/westworld,generic plot line/good/westworld,"Good/like the show/everything,Informative/detailed,Good cast/actors,Like the writing/dialog,,,"
"The acting, characters, plot",characters/plot/acting,characters/plot/acting,acting,acting,"Good acting,Good storyline/subject matter,,,,,"
The character interactions.,character interactions/interactions/character,character interactions,character,character,"Like the characters interaction,,,,,,"
werujiuhgfrdswetgyhujygfswetghujhgfdesdghjmhgvfcdx,werujiuhgfrdswetgyhujygfswetghujhgfdesdghjmhgvfcdx,werujiuhgfrdswetgyhujygfswetghujhgfdesdghjmhgvfcdx,,,"None/no answer,,,,,,"
i like the idea of people interacting with AI robots,people interacting/robots/like/idea/people,people interacting/robots/like/idea,ai robots,ai robots,"Like the characters interaction,,,,,,"
it was so great,great,great,,,"Good/like the show/everything,,,,,,"
none,none,none,,,"None/no answer,,,,,,"
i like the story,story/like the story/like,like the story,,,"Good storyline/subject matter,,,,,,"
The idea that there are AI all over & you can't tell who is who.,tell/idea,tell/idea,idea,idea,"Technological aspects (inclusion of robots, exploring AI, etc.),Suspense/Mystery/thrillers,,,,,"
constant twist and turns in the plot,constant twist/constant/plot/twist/turns,constant twist/plot/turns,constant,constant,"Suspense/Mystery/thrillers,,,,,,"
The developing storyline. How it explores how each character has arrived at this point,developing storyline/storyline/developing/point/explores,developing storyline/point/explores,storyline,storyline,"Good storyline/subject matter,Appealing characters/I like the characters,,,,,"
the cast,cast,cast,,,"Good cast/actors,,,,,,"
always unexpected. makes you work and think while watching. Intelligent,always unexpected/always/unexpected/intelligent/makes,always unexpected/intelligent/makes,unexpected,unexpected,"Suspense/Mystery/thrillers,Attention grabbing/holds interest/keeps you wanting to watch more,,,,,"
How it takes place and the whole story line,whole story line/story line/takes place/whole story/line,whole story line/takes place,whole story,whole story,"Good storyline/subject matter,,,,,,"
GOOD,good,good,,,"Good/like the show/everything,,,,,,"
The story line and the character's,story line/character/story/line,story line/character,story,story,"Good storyline/subject matter,Appealing characters/I like the characters,,,,,"
I'm a fan of sci-fi. And this sci-fi is excellent,sci/fan/fan of sci/excellent,fan of sci/excellent,sci/fan,sci/fan,"Science fiction/fantasy,,,,,,"
I watch it sometimes because my boyfriend likes it.,boyfriend likes/watch/sometimes/boyfriend/likes,boyfriend likes/watch/sometimes,,,"Have not watched enough to comment/not familiar with the show,,,,,,"
It is made so well - and the action is big and gory - I like the actors too,well/gory/made so well/big and gory/made,made so well/big and gory,big/action,big/action,"Other show characteristic mentions,Like the action/adventurous,Violence,Good cast/actors,,,"
There is nothing else like it and it feels that our world is headed in the same direction. all the data and privacy issues and people at the top always win and us at the bottom can't even get a job. Feels like we don't have a choice sometimes.,nothing else like/nothing else/else like/top always win/direction,nothing else like/top always win/direction,privacy issues/same direction/world,privacy issues/same direction/world,"Other storyline/Plot mentions,,,,,,"
The story,story,story,,,"Good storyline/subject matter,,,,,,"
I like to binge watch. It has an interesting storyline that keeps me engaged.,binge watch/watch/like/binge/engaged,binge watch/like/engaged,interesting,interesting,"Interesting/engaging,,,,,,"
The unexpected twists are great. The control over our destinies is really thought provoking,unexpected twists/really thought provoking/great/twists are great/thought provoking,unexpected twists/really thought provoking/twists are great,unexpected twists,unexpected twists,"Suspense/Mystery/thrillers,Thought provoking,,,,,"
With all the action and drama that the show has makes it even more interesting to keep watching and waiting for next weeks episode.,next weeks episode/weeks episode/keep watching/next weeks/episode,next weeks episode/keep watching,next weeks episode,next weeks episode,"Like the action/adventurous,Like the drama,Attention grabbing/holds interest/keeps you wanting to watch more,,,,"
Westworld is amazing one of the best shows ever,best shows ever/shows ever/amazing one/best shows/westworld,best shows ever/amazing one/westworld,best shows,best shows,"Good/like the show/everything,,,,,,"
its sees too good than other movie or other series so its too good than other things really it was too good,good/series/sees/movie/things,good/series/sees/movie/things,other movie/other,other movie,"Good/like the show/everything,,,,,,"
Thinking about if this canreally happen in the future.,canreally happen/thinking/future/canreally/happen,canreally happen/thinking/future,,,"Futuristic,,,,,,"
"The characters are interesting, and the hosts finally gaining their own agency is exciting to watch.",hosts finally gaining/hosts finally/finally gaining/interesting/watch,hosts finally gaining/interesting/watch,own agency/characters,own agency/characters,"Appealing characters/I like the characters,Exciting,,,,,"
Just a fun story line,fun story line/story line/fun story/line/fun,fun story line,story,story,"Witty/humorous/funny/entertaining,,,,,,"
Mostly the cast and production value.,production value/mostly/value/mostly the cast/cast,production value/mostly the cast,production,production,"Good cast/actors,High quality show/high production values,,,,,"
A.I. becomes real with emotions like humans and can be reprogrammed. The future of being there be kinda weird.,emotions like humans/becomes real/emotions like/like humans/becomes,emotions like humans/becomes real,kinda weird/a.i.,kinda weird/a.i.,"All negative mentions,,,,,,"
The futuristic possibilities make it a good show,futuristic possibilities make/good show/possibilities make/show/futuristic,futuristic possibilities make/good show,futuristic possibilities,futuristic possibilities,"Futuristic,Good/like the show/everything,,,,,"
I like the idea of artificial intelligence and the cruelty of mankind that this show brings to light,artificial intelligence/show brings/light/brings to light/like,artificial intelligence/show brings/brings to light/like,artificial intelligence/idea,artificial intelligence/idea,"Like the concept/idea of futuristic amusement park,Technological aspects (inclusion of robots, exploring AI, etc.),Other realistic/association with real life mentions,,,,"
"Complex ideas, interesting world and characters",complex ideas/interesting world/complex/ideas/interesting,complex ideas/interesting world,complex ideas,complex ideas,"Complex storyline,Interesting/engaging,Like the premise/setting/scenery,Appealing characters/I like the characters,,,"
Westworld,westworld,westworld,,,"Good/like the show/everything,,,,,,"
My husband watches it and I’m in the room,husband watches/husband/watches/room,husband watches/room,husband,husband,"Have not watched enough to comment/not familiar with the show,,,,,,"
It makes a good show because it’s something different I haven’t seen on tv before,something different/good show/something/seen/makes,something different/good show/seen/makes,good show,good show,"Good/like the show/everything,Unique/different,,,,,"
the original movie,original movie/movie/original,original movie,original,original,"Already seen/like the original movie,,,,,,"
It always has me thinking,thinking/always,thinking/always,,,"Attention grabbing/holds interest/keeps you wanting to watch more,,,,,,"
"I think Westworld is interesting because I think that our world could end up looking like this very soon. Artificial intelligence is quite interesting to me. Who knows where we're going to end up. I don't know if we will treat robots this way, but I feel like it's a possibility.",think westworld/world could end/world could/could end/westworld,think westworld/world could end,artificial intelligence/interesting/westworld,artificial intelligence/interesting/westworld,"Interesting/engaging,Technological aspects (inclusion of robots, exploring AI, etc.),,,,,"
greart,greart,greart,,,"Good/like the show/everything,,,,,,"
the show is totally different. i love everything about the show. i like shows that are unique,totally different/different/show/totally/love everything,totally different/show/love everything,different/show,different/show,"Unique/different,Good/like the show/everything,,,,,"
weqrweqrcwercweqrcwerqwerrcweqrcqwerc,weqrweqrcwercweqrcwerqwerrcweqrcqwerc,weqrweqrcwercweqrcwerqwerrcweqrcqwerc,,,"None/no answer,,,,,,"
Seeing the plot developments and what happens to the characters.,plot developments/seeing/characters/seeing the plot/plot,plot developments/characters/seeing the plot,plot,plot,"Good storyline/subject matter,Appealing characters/I like the characters,,,,,"
The line between morality for a character that is not technically alive,technically alive/alive/line/morality/character,technically alive/line/morality/character,morality/line,morality/line,"Other misc. mentions,,,,,,"
The complex characters and twisty turny story,twisty turny story/turny story/complex characters/twisty turny/story,twisty turny story/complex characters,turny/complex,turny/complex,"Like the character complexity,Suspense/Mystery/thrillers,,,,,"
like sci-fi,like sci/like/sci,like sci,sci,sci,"Science fiction/fantasy,,,,,,"
"I was very interested in season one. I did not automatically love the show, but I was always wondering what would happen in the next episode. Season two was disappointing to me and I lost some of my overall interest. However, I really liked the story lines with Shogun World and the Ghost Nation. I was even less interested in season three - I miss the parks and I think they left the parks too early in the series. I don't care about the real world as much.",season one/season/ghost nation/one/shogun world,season one/ghost nation/shogun world,story lines/overall interest/next episode/world/ghost,story lines/overall interest/next episode/world/ghost,"All negative mentions,,,,,,"
I like the genre and the exploration of potential future worlds,potential future worlds/future worlds/like the genre/potential future/worlds,potential future worlds/like the genre,potential future,potential future,"Like the genre,Futuristic,,,,,"
"great plot twists, good acting",great plot twists/good acting/great plot/plot twists/great,great plot twists/good acting,plot/good,plot/good,"Suspense/Mystery/thrillers,Good cast/actors,,,,,"
