the mystery and lore,lore/mystery and lore/mystery
It has great riveting storytelling and visuals.,great riveting storytelling/great riveting/riveting storytelling/visuals/storytelling and visuals
The concept of the show is interesting and falls into the genre I like. I haven't watched more because there are so many seasons and it is a long time commitment.,long time commitment/like/time commitment/concept/show
The story line and the surprise ending,surprise ending/story line/ending/story/line
IS UNIQUE GOOD STORY,unique good story/good story/unique good/story/unique
yes i lik this,yes/lik
SPORTS,sports
"Intense storyline, the key concept of the show, detailed, has just enough of a splash of violence and nudity to add to the story.",intense storyline/key concept/nudity to add/detailed/intense
its good to use overall,use overall/overall/good/use/good to use
"enjoy the plot twists and seeing where they end up, I am about to rewatch season 2 and then season 3",plot twists/rewatch season/enjoy/season/enjoy the plot
it is very raw and authentic,authentic/raw and authentic/raw
It is great plotting and characterization,great plotting/characterization/plotting and characterization/great/plotting
diffrent than ofhte progams,ofhte progams/diffrent/progams/diffrent than ofhte/ofhte
The cast is different than most other shows and has a unique theme that is followable.,unique theme/followable/cast/different/shows
The scfi setting makes it cool,scfi setting makes/scfi setting/setting makes/cool/makes it cool
Its complex. I'm trying to figure out what Delores is up to.,complex/delores/trying/figure/trying to figure
The story and the tone of the show,show/story/tone
"The setting, and the technology. couple that with complex and intricate twists in the story line, and you have an excellent show.",setting/technology/story line/excellent show/intricate twists
"I was familiar with earlier iterations of Westworld and was pretty exited when I heard about the show, so I may be a little biased. And knowing that HBO was producing it also added to the excitement. They (HBO) have become synonymous with good hour long dramas and lead the way in modern TV story telling. The cast looked good from the start and they haven't disappointed me yet in terms of effort and class acting.I was already a fan of Jonathon Nolan and his writing, etc. etc. etc. And still aside from all of that bias, it manages to live up to my expectations. The writing is gripping and involving and I can't wait to see what happens next.",little biased/earlier iterations/pretty exited/westworld/etc
Rebellion,rebellion
I think that the acting and the excitement makes this show enjoyable.,show enjoyable/excitement makes/enjoyable/think/acting
I love the thriller scifi aspect of the show. I am fascinated by the concept of the AI and I love mysteries. This show does a really good job of keeping you guessing and adding intrigue. The acting is also phenomenal.,thriller scifi aspect/thriller scifi/scifi aspect/love mysteries/love
I love that it’s realistically portrayed,realistically portrayed/realistically/portrayed/love
Westwood explained more about the charters back stories tHan Sea son 1,charters back stories/sea son/westwood explained/charters back/back stories
I love the dynamics between Caleb and Delores. They are an interesting new duo and I cannot wait to see how their storyline evolves. Maeve is great played by Thandie Newton.,delores/caleb and delores/caleb/thandie newton/dynamics between caleb
The idea that artificial intelligence reaches a pinnacle of human beings and exceeds them.,artificial intelligence reaches/artificial intelligence/intelligence reaches/human beings/idea
I think it has really good acting and suspense. I really like the complex storylines and like the characters. I like the futuristic aspect and technology parts of the show.,really good acting/good acting/really good/suspense/like
"The storylines are absolutely intriguing, the characters are multi-leveled and extremely interesting and love the unexpected plot twists! Although I was sad that the killed the little boy and husband in the last episode - very dark and sad! Curious if we are going to see Sir Snthony Hopkins make an appearance!",unexpected plot twists/absolutely intriguing/leveled and extremely/plot twists/extremely interesting
The uncertainty of what may or may not happen. The parts that keep you on the edge of your seat wondering what will happen next.,may/happen next/happen/may or may/uncertainty
Because of the sci-fi futuristic environment set in the wild west era,wild west era/futuristic environment set/west era/environment set/wild west
great wring,great wring/great/wring
I like the technology aspect and that computer generated characters share such humanistic characteristics,computer generated characters/generated characters share/humanistic characteristics/technology aspect/computer generated
I think the characters more than anything. I am a big Ed Harris fan and like Anthony Hopkins also.,anthony hopkins also/like anthony hopkins/anthony hopkins/hopkins also/anything
Just the overall writing and concepts of the show is unlike anything else ive seen on tv. The real life fears with the world about AI and how they are depicted within the script are amazing. I also enjoy the cast of very talented and not necessarily the most heralded. There aren't many scenes or episodes as to me truly knowing what to expect next.,unlike anything else/overall writing/unlike anything/anything else/real life fears
"Season 1 was incredible. The complex, yet thought provoking storyline, combined with a very cool concept and a thrilling twist at the end. I was hooked. Season 2 had some emmy-award-level episodes (Aketchta episode) but the overall storyline, especially the ending, was all over the place. I've only heard that season 3 is similar.",thought provoking storyline/yet thought provoking/incredible/aketchta episode/season
It's thought-provoking and is high-quality like most HBO programming,hbo programming/thought/quality like/hbo/provoking
"Good story line, good action",good story line/good action/story line/good story/good
Its a well written thrill with several plot twists and unexpected events that keep me on engaged,well written thrill/several plot twists/well written/written thrill/several plot
You can fantasize about something that is not real,real/fantasize/something/fantasize about something
"the acting, the story, the worlds they create. The whole concept is interesting.",acting/story/create/worlds they create/whole concept
"The acting is second to none. The constantly building, interweaving narrative web is incredibly intricate, but always comes together in the end. Love the depiction of the near-future, and the cost and consequences of technology.",interweaving narrative web/always comes together/constantly building/incredibly intricate/none
"Actually it's the writing/dialogue between the characters. It's very profound, although sometimes it is confusing. I usually have to watch each episode twice so that I will understand the plots.",actually/writing/dialogue/characters/although sometimes
I love that this show has a futuristic overtone to the western world. Its great.,western world/futuristic overtone/world/love/show
It is an interesting show I enjoy it a ton,interesting show/ton/interesting/show/enjoy
Westworld's world-building is some of the finest I've seen from modern TV.,westworld/world/building/seen/seen from modern
"The future has arrived at Westworld. Or rather, after two seasons spent in the amusement parks where the hosts acquire self-awareness, we finally take a look at what is hidden behind the curtain in a third that represents an evolution of everything we have seen so far. There are no longer narrative puzzles resulting from Bernard's mental confusion or the slow and traumatic awakening of Dolores; the fight for control of the world is now a reality and will take place on the streets digitized",hosts acquire self/two seasons spent/westworld/arrived at westworld/acquire self
What draws me into the show and makes me enjoy watching is that they have come up with such an original idea/storyline. I like that they live out their fantasies and the consequences that result from all this. I really feel they have complex characters and some of the best actors out there. It's something that is fun to watch. I'm a big sci fi fan so this is the type of show I really enjoy.,original idea/storyline/enjoy watching/idea/draws
I love the sci-fi genre and this is action packed and thrilling,action packed/sci/thrilling/love the sci/packed and thrilling
exciting do not know what will happen next unpredictable,happen next unpredictable/next unpredictable/happen next/exciting/unpredictable
The pure insanity and chaos. Of course the beautiful women help,pure insanity/beautiful women help/chaos/insanity and chaos/women help
The cast.,cast
The discussin of privacy and free will,discussin/privacy/free/discussin of privacy/privacy and free
Znznznz znznzznz znz z snz snz zbz zjs sns sns sns sns sbs sns sns sns snsnsms sdkd d dnd djsbs sns dnd,snz zbz zjs/snz snz zbz/znznznz znznzznz znz/sns sns sns/sns sns
good,good
The aspect of using high technology in a system that we only imagine now.,using high technology/using high/high technology/aspect/using
good,good
I really enjoy watching Westworld because it is a complex and thrilling show,enjoy watching westworld/really enjoy watching/watching westworld/thrilling show/really enjoy
Thinking kinda show you have to almost watch each episode twice.,thinking kinda show/thinking kinda/episode twice/kinda show/almost watch
Interesting story,interesting story/interesting/story
The settling,settling
To be honest I like it but I only see it if there is nothing better to see.,honest/see/like/nothing/better
"is interesante, and unique",interesante/unique
"I like the plot twists and the characters the most, also a lot of people talk about it.",plot twists/people talk/also/like/plot
I like the tone the show gives off.,like the tone/show gives/like/tone/show
The unexpected direction the show takes,show takes/unexpected direction/takes/unexpected/direction
Not quite sure,quite sure/sure/quite
the ebst,ebst
Its very good sci fi,good sci/good/sci
It has a lot of western and sci fi espisodes,espisodes/sci fi espisodes/lot/western/sci
This show is so unique and innovative has such a great cast i really love evan rachel wood and watch everything she is on and also the show is more thrilling than others and keeps me on the edge of my seat every single time,great cast/every single time/really love evan/love evan rachel/evan rachel wood
i love the setting of it and the robots,robots/love/setting/love the setting
It is a unique twist on sy-fi and fantasy while being a thriller all in one,unique twist/one/unique/twist/fantasy
I loke this pptiom best it is good,pptiom best/good/loke/pptiom/best
The characters and the settings where it takes place,takes place/place/characters/settings/takes
the mystery of the show,show/mystery
good story,good story/good/story
I think the concept of people living out their fantasies through AI is fascinating and the show explores a lot of deep questions about human behavior and impulses.,people living/show explores/deep questions/human behavior/impulses
"The suspense, the future setting and my love of the original classic Westworld and Futureworld draws me into this show and makes me want to watch. All of these things make it a good show.",original classic westworld/classic westworld/futureworld draws/future setting/original classic
i like the characters and story,story/characters and story/like/characters/like the characters
"THE CONCEPT OF SOMETHING LIKE THIS EXISTING IN THE WORLD TODAY, ALTHOUGH SEEMS TOO FAR-FETCHED, WOULD BE UNBELIEVABLE",world today/although seems/something like/fetched/today
I think the characters are interesting and the story is evolving and becoming more interesting,interesting/think/characters/story/evolving
new concept,new concept/new/concept
great plot twists,great plot twists/great plot/plot twists/great/twists
the acting,acting
complex story lines,complex story lines/complex story/story lines/complex/lines
I really love sci fi genres,really love sci/really love/love sci/genres/sci fi genres
"The Sci Fi elements as well as the acting, which are very good.",elements as well/sci/acting/good/sci fi elements
the scifi aspect and how it makes me question reality like the matrix,question reality like/scifi aspect/question reality/reality like/matrix
I like the interplay between humans and robots,robots/humans and robots/like/interplay/humans
Its so unique. There are other shows depicting the future of technology but I think this one is the best. Especially with the timing of it coming out where video games that are very similar to the plot of the show are so popular. I think everyone can find something that they like in it. I love that it makes you think and you don't know where the season is going until it is over. even then you're still left questioning things which make you look forward to the new season and make it a topic of conversation with friends,unique/think/shows depicting/season/make
I don't care for the show. I tried to like it but can't seem to stick with it.,care/show/seem/tried/like
khujg rdfg ghjh ghffuy eyjhh jh,khujg rdfg ghjh/rdfg ghjh ghffuy/ghjh ghffuy eyjhh/khujg rdfg/rdfg ghjh
It is unlike any other tv show produced right now,show produced right/show produced/produced right/unlike/show
"I am big into the sci-fi genre, and this season's focus on data collection and AI is very timely and interesting. Additionally, the character arcs are amazing and the build up throughout the season where you have to piece together the information you are getting is thrilling and exiting.",data collection/sci/genre/focus/interesting
it seems interesting and differnt than what is on now,seems interesting/seems/interesting/differnt/interesting and differnt
the setting and the storyline,storyline/setting
I like the drama and the suspense,like the drama/suspense/like/drama
i just love the whole concept and writing of the show. this couldve been a show that had a great story line but was shot poorly. the writing and director really brings the story and concept to life.absolutely amazing show.,whole concept/show/great story line/love/whole
"The writing, the sci-fi setting and the characters and how they deal with the situations that arise (especially Dolores, Maeve and the Man in Black).",especially dolores/dolores/maeve/black/man in black
Love the storyline,love/storyline/love the storyline
i have nothing specific to say here,nothing specific/nothing/specific/say/specific to say
The diversity of the cast is remarkable. I'm a big fan of a lot of the actors on the show including Jeffery Wright and Thandie Newton. Its a pleasure to watch.,including jeffery wright/show including jeffery/thandie newton/jeffery wright/including jeffery
It's unique and interesting,unique/interesting/unique and interesting
the entertainment,entertainment
I like westworld,like westworld/westworld/like
"The entire premise of the show reminds me of a futuristic Fantasy Island, a show that was near and dear to me growing up and the modern-day adaptation did not live up to. Westworld takes this a bit farther with the wild west theme setting it apart from most other shows on TV. The show consistently rotates in fresh faces so you never really know what will happen next. I also like that while the show is about Westworld, plenty of action happens elsewhere in this universe so the scenery never becomes stale",futuristic fantasy island/fantasy island/futuristic fantasy/day adaptation/entire premise
Trying to unravel everything and constantly being on the edge of my seat.,unravel everything/trying/seat/trying to unravel/unravel
"Curious to know what plot twist can come next; what is Delores' ultimately plan, it is suspenseful",ultimately plan/come next/plot twist/delores/curious
I aint explaining crap to yall robots.,explaining crap/robots/explaining/crap
The sy/fi aspect and plot twists at every turn. I enjoy shows that make you think and leave you on cliff hangers.,every turn/plot twists/turn/cliff hangers/aspect
"I personally have not sat down to watch more than the pilot episode. I binge watch series quite often so I intend on trying to get into Westworld. Actually, it will probably be the next show I try to get into but right now my wife and I are binge watching True Blood.",pilot episode/watch series quite/binge watch series/watching true blood/true blood
interesting show,interesting show/interesting/show
Westworld is an exclusive theme park where those who can afford a ticket can live without limits.,live without limits/exclusive theme park/without limits/exclusive theme/theme park
It is a unique storyline,unique storyline/storyline/unique
"I like all the actors. I keep watching hoping it will get better and less confusing. It just keeps getting whackier and confusing. I thought last year was mixed up, but this year is really nutty, hard to follow and kind of beginning to wish they would all just be gone.",actors/confusing/less confusing/keep watching hoping/like
I started to watch because I heard good things and the fact it had Anthony Hopkins in it. The show is sort of confusing. I would like to know what the pearls are.,heard good things/anthony hopkins/heard good/good things/anthony
because it is the best and i like the most,best/like
Is not a rerun on other channels,channels/rerun
Thefirst one is the one I was looking for a text from you soon and have a great day and I will be there at the,great day/thefirst one/thefirst/day/one
the modern trust on an old western,old western/modern trust/western/modern/trust
"it has an excellent plot, and with a high level cast",high level cast/excellent plot/level cast/high level/plot
The entertainment,entertainment
"How unique it is, both story line and characters. I also enjoy all of the drama in contains.",story line/characters/line and characters/unique/story
it keeps you entertained and attached to it. explore different topics when comparing it with other shows,explore different topics/explore different/keeps/entertained/attached
Meh,meh
Nice,nice
Good writing,good writing/good/writing
I like the cast and plot,plot/cast and plot/like/cast/like the cast
Unique storyline and I saw the original Westworld of 1973 and I thought is was a great movie.,original westworld/unique storyline/westworld/westworld of 1973/unique
the acting is awesome and the storyline is so different and interesting,interesting/different and interesting/acting/awesome/storyline
"its violence, Nice",nice/violence
I haven't watched season 3 yet.,watched season/watched/yet/season
The characters and the sci-fi,sci/characters
I like the cast and like that it is a new and different show.,different show/show/like/cast/new
"The more you watch it, the more you fit the pieces to the puzzle in the show. It makes you think and it unlike any show out there, the storyline doesn't compare to anything else.",fit the pieces/anything else/show/watch/fit
The way that AI is depicted and portrayed on the show,show/way/depicted/portrayed/depicted and portrayed
the story and characters,characters/story and characters/story
The futuristic nature of the characters,futuristic nature/characters/futuristic/nature
No,
It makes me think,think/makes me think/makes
"I have only seen a few episodes, but I am looking forward to watching the show again",looking forward/episodes/seen/looking/forward
I like it because it is a futuristic concept and unlike any other tv show on tv.,futuristic concept/like/futuristic/concept/unlike
The story and the fact it’s hbo,hbo/story/fact
I’m just interested in futuristic stories. I need to watch all of the episodes to get a better understanding.,futuristic stories/stories/better understanding/interested/futuristic
"The great writing, twists and turns, great cast, and unique nature of the show.",great writing/great cast/unique nature/writing/twists
it is great totally,great totally/totally/great
I honestly believe that this season is one of the best i think that its perfect.,honestly believe/perfect/honestly/believe/season
I like the concept and the complex storyline.,complex storyline/like the concept/storyline/like/concept
Is amazing an impact in and the cast is really good,really good/good/amazing/impact/cast
How exciting it is,exciting
The intricate storytelling that involves interesting and compelling plot twists. Complex characters that are played by a talented and multicultural cast. Amazing special effects.,compelling plot twists/plot twists/intricate storytelling/involves interesting/compelling plot
I like that it is a show that is like a horror and mystery genre type of show. It is interesting and fun to watch.,mystery genre type/mystery genre/genre type/like/show
It different then other shows that i watch it gives me something new,something new/new/different/shows/watch
who is real,real
The storyline and plot does.,storyline/plot/storyline and plot
Get some more action to go,get/action
LIKED THE ORIGINAL MOVIE,original movie/liked/movie/liked the original/original
insurance companies to do this employer asks for me know what they will have been in my head,insurance companies/employer asks/insurance/head/companies
"The actors, I want to know more about cast",actors/cast/want/know/want to know
It is well written and hard to know where it will go next story wise. It has great acting and special effects. I like Aaron Paul as a new addition this season. I also love the new direction the show took this season outside of the park with new characters,next story wise/story wise/well written/next story/like aaron paul
good,good
i don't know,know
The script and the deep deeper and deepest part of the shows reality,shows reality/deep deeper/deepest part/reality/script
"I like the storyline, and what draws me into this show is what will happen next. Meaning, will the story give us hints on the future of the A.I's and if they will feel what humans feel, etc. It is a good show because I love drama stories.",happen next/storyline/next/like the storyline/like
there is no other show that can command your total attention as Westword. evan rachel wood is fantastic. thandie newton is also fantastic . this great groups of actors makes Westworld.,total attention/westword/attention as westword/evan rachel wood/fantastic
There are unexpected twists,unexpected twists/twists/unexpected
its different and pretty cool,pretty cool/cool/different/pretty/different and pretty
I want to see where Dolores' struggle takes her and how does Aaron Paul's character help. I also want to see what happens to Mauve.,aaron paul/character help/struggle takes/dolores/paul
"The complexity of the story keep unraveling like peeling back layers to an onion and I want to know what is controlling this universe. Although I'm mostly confused to what the ""big picture"" is, I want to know more.",story keep unraveling/keep unraveling like/unraveling like peeling/like peeling back/peeling back layers
THe plot and the characters and the actors.,actors/plot/characters
"The setting and people talking about it, saying how good it is, makes me want to watch it. The characters and plot make Westworld a good show.",people talking/plot make westworld/make westworld/good show/saying
Its different.,different
the concept of artificial intelligence and about being sentient,artificial intelligence/sentient/concept/artificial/intelligence
I just love this type of show,show/type of show/love/type/love this type
I really enjoyed the park setting I know you probably can’t go back to it but the show was so much more enjoyable at least for me. It’s still fine need to sit down and watch the third season,park setting/really enjoyed/setting/really/enjoyed
its very great,great
"The intriguing concept as I loved the movie the series is based on, but season 2 was a mess and season 3 so far have been a hit and miss trying to recover from that.",intriguing concept/loved the movie/miss trying/season/intriguing
I love the cast and the overarching theme of man against technology and artificial intelligence.,artificial intelligence/love the cast/overarching theme/intelligence/love
The blurrying of what is a real person and what is not. The idea of them demanding a life and purpose.,real person/blurrying/real/person/purpose
My husband watched it so I wanted to try it,husband watched/husband/watched/wanted/try
que es muy buena serie,muy buena serie/buena serie/muy buena/que/serie
I just like the show and especially Thandie Newton who looks and acts like a modern Vivienne Leigh.,modern vivienne leigh/especially thandie newton/vivienne leigh/thandie newton/especially thandie
"It allows its visitors to live out their fantasies through artificial consciousness - I think that is really cool! No matter how illicit the fantasy may be, there are no consequences for the park's guests, allowing for any wish to be indulged - that is what really draws me in.",artificial consciousness/really cool/consciousness/cool/guests
Unique,unique
Can't be killed,killed
this quality is very well,well/quality
It can be very addicting,addicting
Na,
the moral implications of ai,moral implications/moral/implications
The characters and the good acting and detail,good acting/detail/acting and detail/characters/good
The plot and the twists and turns,turns/twists and turns/plot/twists
Great desires and other things,great desires/great/things/desires
Watching each character and discovering their motives,watching/motives/watching each character/discovering their motives/character
n/a,
Aaron Paul and ed Harris are reasons that drew me in in the first place and keep me hanging in. I like most sci fi shows.,aaron paul/first place/paul/harris/aaron
