I like everything about it. I find it interesting,like everything/like/everything/interesting/find
"The characters are outstanding, the writing is excellent, the show is sleek and beautiful looking, and I love the philosophical elements of the show and how they reflect on our current society. I also need to mention the outstanding score by Ramin Djawadi. He does an amazing job of portraying and driving the mood of each episode through his creative use of music. He should be winning way more awards for his work on this show. It's one of the best programs currently on HBO.",beautiful looking/current society/philosophical elements/ramin djawadi/outstanding score
the technology aspects,technology aspects/aspects/technology
"It approaches and analyzes the human condition from a veiw-point not yet looked at before. It is interesting and without a doubt intriguing to see what, and who, a person would change about their life--making it a fantasy world--if only they were given the permission.",human condition/yet looked/person would change/veiw/point
it is compelling and interesting to see a new take/theory on how technology could play a part in the future,technology could play/new take/technology could/could play/take
The cast the scifi elements mostly the integation of future and past,scifi elements mostly/scifi elements/elements mostly/past/future and past
"The idea, the cast, the design, the plot. It’s just a great modern show to watch. I love it with the passion. Each character has a different vibe.",great modern show/idea/cast/design/plot
It is on HBO so i gave it a try,hbo/try/gave
It is a good show,good show/show/good
Very nice,nice
The characters the details and the plot,characters the details/plot/characters/details
"In general I really like the plot, I think it's excellent and of the highest quality.",highest quality/really like/plot/excellent/quality
Y for the. In more gre for a way to all for gggg in her dime for. Then osc in great to,gre/way/gggg/dime/osc
Nothing,nothing
"It is complex, interesting, about things I would not ordinarily think about, and especially my friends all love it and we watch together.",watch together/ordinarily think/interesting/complex/together
It is incredibly well done and the acting is great.,incredibly well done/incredibly well/well done/great/acting is great
The complex storyline helps keep me captivated.,complex storyline helps/storyline helps keep/complex storyline/storyline helps/helps keep
Just confusing enough to really make me want to pay attention. The themes are big but have big implications as well not just in the show. Makes you thin!,pay attention/confusing enough/really make/attention/confusing
The futuristic elements and how it keeps you hanging after each episode. It’s different,futuristic elements/episode/different/futuristic/elements
The characters are the best part of the show.,best part/show/characters/best/part
it is very intriguing. i always wonder what's going to happen next,intriguing/happen next/going/next/always
"The storyline, what the show is about. It is different from any other show I’ve watched.",storyline/watched/show/different
"It has a cool premise, between the park and everything it gives me Jurassic Park vibes while also being completely different",jurassic park vibes/jurassic park/cool premise/completely different/park vibes
"I like the concept and I am emotionally invested. I started watching this show because of the concept now Im invested in the people. the new people, the park, the crazy fantasys and everything else that is going on. I would only stop watching if I got bored but its a really good show.",emotionally invested/concept/invested/people/new people
Okay,okay
the whole theme of the series.,whole theme/series/whole/theme
I love that there are no weak links in the cast and the sci fi elements are unlike anything else.,unlike anything else/anything else/weak links/unlike anything/else
I actually have only seen a few episodes out of order. I personally find the show to be somewhat hard to watch because of violence.,order/actually/seen/episodes/personally find
there isn't anything else that makes me want to watch that i'm not already invested in,anything else/already invested/anything/else/makes
I don’t like the show.,like/show/like the show
The creativity and interesting moves that they have on the show. The cast is one thing but its the interesting plot that always gets me. It's so different than any other show out there and has to be a top 15.,interesting moves/interesting plot/interesting/creativity/moves
It was something my spouse chose to watch. Never was really much of a fan,spouse chose/watch/chose to watch/something/spouse
The dark twist and turns of the plot also the it being futuristic.,dark twist/plot also/futuristic/dark/twist
the characters,characters
The first one is the one I was looking for a text from you soon and have a great day and I will be,great day/first one/one/day/first
I really love the characters of the show and that’s why I’m interested to watch the show,really love/love the characters/show/interested/interested to watch
"I enjoy science fiction. Even though it is hard to follow at times, it is very intriguing and makes you think. I usually have to google what stuff means or could mean after the show I order to follow it, and some stuff is off the wall, but the characters draw you in and keep you wanting more.",enjoy science fiction/science fiction/enjoy science/fiction/even though
It’s intriguing & ahead of our time literally,intriguing/time literally/ahead/literally/time
that how exciting every season and episode they have and they always make you think what will next,exciting every season/exciting every/every season/always make/next
its great,great
i like everything,like everything/everything/like
I like how it is sci-fi related. I like how they get sentience and how everything turns out.,like/sci/related/get sentience/everything turns
"The show is completely unique and in its own category. It has so many very defined levels to it. It has plot twists and is categorically exciting to watch. I love the characters also. It draws you in during season 1 because who would not want to pay to live out their fantasies, in addition to the behind the scenes action at the park.",completely unique/category/show/completely/unique
HJK,hjk
The storyline and cast,cast/storyline and cast/storyline
The unknown,unknown
Well written and very engaging,well written/well/engaging/written
It's a fantasy world but there are still very relatable and relevant themes. I like the actors that are in teh show.,fantasy world/world/relevant themes/fantasy/teh show
my husband got me into it. the location of the show started me.,husband got/husband/got/show started/location
"I really don’t like this season, too confusing",like/season/confusing/like this season/really
The concepts and implications of artificial intelligence,artificial intelligence/intelligence/concepts/implications/artificial
THe sci fi genre and all of the intelligent writing. I like watching stories like west world that make you think and require a certain amount of engagement. Sometimes altering you mindset during the viewing.,intelligent writing/writing/like watching stories/watching stories like/stories like west
Differentiated relative to other shows,differentiated relative/differentiated/shows/relative
it is very funny,funny
action,action
I do not find it to be a good show and have not made it past the first 3 episodes of the first season.,first season/good show/season/first/find
not sure i would like show,would like show/like show/would like/show/sure
cast,cast
All good,good
his former and also the story that l like,like/former/also/story/former and also
great story line great cast,line great cast/great story line/story line great/great cast/story line
"Is very good, excellent",excellent/good
Story,story
I’m just trying to figure it all out.,trying/figure/trying to figure
-,
the collaboration of dolores and aaron paul,aaron paul/paul/collaboration/dolores/aaron
I love their stories,stories/love their stories/love
AI is always super interesting,always super interesting/super interesting/always super/interesting/always
"I feel the graphics and shooting is high quality. The acting seems real and unforced. It keeps me engaged, I am not bored when watching it.",high quality/quality/feel/graphics/shooting
"Featuring a star-studded cast with Evan Rachel Wood, Thandie Newton and Ed Harris. Watch the trailer and find out more about Westworld on HBO.com.",evan rachel wood/rachel wood/thandie newton/evan rachel/studded cast
A futuristic show that leads me to watch more and more each week. Good line up of good looking women.,futuristic show/week/futuristic/show/leads
"The best sci-fi show of all time and offers deeper thought than a philosophy or religious course. This show is utterly beautiful while also gritty, and even eerie at times. This show is a microcosm that represents what humans are capable of. Unpredictable, the script is intelligently written and pieced together. The filming is memorizing in cinematographic appeal. Among the many themes throughout Westworld, the nature of reality and the nature of humanity are at it's core. This show's plot, the logistical details of the AI, and the universe they exist in are well thought out and blend together nicely. Every character has a backstory and motives in such a way that builds interesting character depth. It is fun to see how characters adapt to the world as they learn. While multiple plot lines are intertwined, raw action and twists constantly occur in this crazy universe that is constantly on the verge of catastrophe. This show addresses questions such as: What does it mean to be human? What does it mean to exist? What is my purpose? This is explored and searched for by the main characters. While these are introspective questions that can be explored internally; parallel to this musing, their search is embedded in the reality they find themselves in externally. Moreover, it is represented by the mysterious prodding and puzzles intrinsic to the immediate world in which they exist. The sci-fi elements of the show touch on advanced AI, multiple realities, self awareness, machine learning, big data, and big tech privacy. This show is spot on by metaphorically addressing these concepts. These issues are becoming more relevant by the day in our lives by shaping the future of human society. Without a doubt, sci-fi has never been done better, making movies such as the Matrix fall to the feet of Westworld and it's unprecedented splendor.",offers deeper thought/religious course/offers deeper/show/best sci
It is simply great!,simply great/great/simply
I enjoy the entire milieu and feel of the show. Very engaging; always keeps you interested even when confused,entire milieu/show/always keeps/enjoy/entire
Nothing. I saw one episode and I did not enjoy ut,nothing/saw one episode/one episode/saw one/episode
I've been watching since the beginning so I wait for the new shows,watching since/beginning/since the beginning/new shows/watching
Plot,plot
The way you have to try to piece together the timelines and not knowing who's a host and who isn't.,piece together/way/try/piece/together
I think that this show just needs to end.,end/needs to end/think/show/needs
The concept of the AI that allows you to have a different experience at the park everytime you go,different experience/park everytime/concept/allows/different
I like it,like
sadasdascas,sadasdascas
it gets weirder and weirder. Sometimes hard to follow,gets weirder/weirder/gets/sometimes hard/weirder and weirder
Not really interested in viewing any more episodes,really interested/episodes/really/interested/viewing
the nudity and the violence,violence/nudity
Nothing,nothing
The futuristic storyline,futuristic storyline/storyline/futuristic
The plot twists and characters are so great,plot twists/great/plot/twists/characters
exciting plots,exciting plots/exciting/plots
no comment,comment
It’s thought provoking and very engaging,thought provoking/thought/engaging/provoking
yes good show,yes good show/yes good/good show/yes/show
Don't know,know
"The concept of AI to the degree portrayed in the show is intriguing. Beyond that, I'm finding that I don't really care about the characters (human or host) because they have so few redeeming qualities.",degree portrayed/intriguing/really care/redeeming qualities/show is intriguing
actors,actors
"Season one was great. Season two went downhill for me. With so many other great shows, I stopped watching it.",season one/season/season two went/season two/one
"Managing the push, pull and desires of game players . Seeing each character evolve and their strengths and weaknesses . Seeing humans devalued and tech valued more",game players/managing/push/pull/players
It's far beyond anything I could imagine on my own,far beyond anything/far beyond/beyond anything/could imagine/far
"not normal world, intriguing way of looking at life",normal world/intriguing way/world/intriguing/life
the show itself is amazing! I want a lot of people to join in and watch with me via zoom!,amazing/show/via zoom/zoom/want
I like sci fi shows that are somewhat possible to happen in the future.,like sci/somewhat possible/future/like/sci
"is modern, technological and entertained",modern/technological/entertained/technological and entertained
i love the setting!,setting/love the setting/love
la trama algo confusa pero muy interesante,trama/algo confusa/muy interesante/algo/interesante
It is new and different,different/new and different/new
Very good service and likely promotion 10 points,good service/likely promotion/points/promotion 10 points/good
The concept is so different than anything else,anything else/else/concept/different/anything
I just love the idea of a theme park with robots where you can literally do anything. I also love all the plot twists.,theme park/anything/love/literally do anything/also love
alot of my friends like to watch it,friends like/alot/friends/like/watch
good,good
That it is a park that is futuristic and they can see their wildest dreams come true,dreams come true/futuristic/come true/wildest dreams come/park
The great cast members and the setting of the show,great cast members/great cast/cast members/show/great
The complexity of the characters plus the high level of twists and turns in the overall story make it interesting.,overall story make/characters plus/high level/overall story/story make
Nothing,nothing
Th concept of a.i,concept
Is very interesting,interesting
It’s amazing and I very much do love it,amazing/much/love/much do love
Te acting. James marsden when he was alive.,acting/james marsden/james/alive/marsden
"I love the cast and overall character stories. It is a well written show, even if at times it is confusing.",overall character stories/character stories/overall character/well written show/stories
The characters and the complex storyline.,complex storyline/storyline/characters/complex
Its just interesting,interesting
good,good
I like the complex storylines and how different things tie together.,things tie together/different things tie/tie together/complex storylines/different things
NOTHING ELSE REALLY DRAWS ME. I'M JUST SO MESMERIZED BY THE SHOW.,nothing else really/else really draws/nothing else/else really/really draws
it is very good,good
the story,story
The acting and storylines are unique and never boring.,never boring/boring/acting/storylines/unique
The concept of the robots becoming something of their own race.,robots becoming something/robots becoming/becoming something/race/concept
action,action
"nothing draws me into this show! I wasted my time watching the first season, hoping it would get better, but nope!",nothing draws/nothing/show/draws/first season
Seems like a show that would have good plot twists,good plot twists/seems like/plot twists/good plot/seems
The intertwining of multiple worlds coupled with the actors/actresses that fill the character roles. Creative writing is tough to top too,multiple worlds coupled/character roles/multiple worlds/worlds coupled/actors
storyline,storyline
the characters are really attractive and amazing,really attractive/amazing/attractive and amazing/characters/really
There isn't another show like Westworld out there. It keeps you engaged and wanting more. We are big sci fi fans.,show like westworld/another show like/like westworld/another show/show like
Unexpected events attract me,unexpected events attract/unexpected events/events attract/unexpected/events
good,good
"I had pretty much given up on it, but need to make sure I'm not wrong.",pretty much given/pretty much/much given/make sure/wrong
It’s intense. Leaves you wanting more,intense/leaves/wanting/leaves you wanting
i prefer not answer on these question,question/prefer/answer/prefer not answer
The complexity of robots coming to terms that they are not human and Deloris' dilemma and how she will deal with it.,robots coming/deloris/human and deloris/dilemma/complexity
"It is an extremely unique show with an innovative storyline that is not really offered anywhere else, in my opinion",offered anywhere else/extremely unique show/really offered anywhere/anywhere else/extremely unique
all very good,good
It's an intriguing concept and made with real money.,real money/intriguing concept/money/intriguing/concept
its cool,cool
the mixing of AI with human interaction. the fact that you can't tell who is real or not. and the fact that the AI's aren't aware that they're AI's.,human interaction/interaction/mixing/human/fact
I like the suspense and the action. Seeing different people hopefully come together,like the suspense/seeing different people/hopefully come together/action/seeing different
story line,story line/story/line
Its fun to watch,watch/fun to watch/fun
The actors,actors
Storyline different from anything else I have watched,storyline different/anything else/storyline/watched/different
Has a good story and characters,good story/characters/story and characters/good/story
it's just very interesting and really well written,really well written/well written/really well/written/interesting
"I am a big science fiction fan. To be honest, I need to rewatch some of the episodes because ive been skipping around and not watching episodes in order.",science fiction fan/big science fiction/fiction fan/big science/science fiction
I've watched it but am not all that interested.,watched/interested
all very good,good
Very good for me and i like it very much,good/much/like
good,good
Enjoy the sci fy/futuristic genre,futuristic genre/enjoy/futuristic/genre/enjoy the sci
it's about the death of humanity,humanity/death of humanity/death
Its interesting and engaging,engaging/interesting and engaging/interesting
It got me hooked episode 1,hooked episode/got/hooked/episode/got me hooked
"This TV-Show has a great potential, I have problems in how the story it´s narrated,but it has that element of intrigue and Sci-Fi I love.",great potential/narrated/show/sci/intrigue and sci
the ww2,ww2
I like it,like
The complexity,complexity
the filming is fabulous,fabulous/filming is fabulous/filming
Nothing in particular,nothing/particular/nothing in particular
The drama and the futuristic theme make me feel very intrigued about serie and I would like to know and see more and more,futuristic theme make/futuristic theme/theme make/serie/intrigued about serie
I like it,like
nothing,nothing
Nothing,nothing
"Great cast & writing. Intriguing concepts explored in the plot — interesting to see what things they make a point to show, even in passing. Fun guessing and eventually seeing how things unfold",great cast/writing/great/cast/intriguing concepts explored
good,good
great drama; thrilling,great drama/thrilling/great/drama
It’s weird,weird
Westworld doesnt appeal even though all my family watch it and recommend it,appeal even though/appeal even/even though/family watch/westworld
"Westworld is innovative, thought-provoking, and intriguing. It is a fantastic dystopia that examines the cross-section of humanity and technology. I love it! I particularly love shows like Westworld that are about sci-fi dystopias and question the right and wrong of technology and the future. Even though they are fantasies at this time, you can't help feel that they may prophesize something about the future. Additionally, the way the show was set up and written was extremely clever and engaging, from the first season's theme park introduction to the new season's step into the real world. Content like this is not frequent and it definitely makes this show a must-watch for a lot of people including me.",shows like westworld/thought/provoking/innovative/intriguing
trying to unravel the mystery,trying/mystery/trying to unravel/unravel the mystery/unravel
because i love this type of movie soo much,movie soo much/soo much/movie soo/much/love
good drama quality,good drama quality/good drama/drama quality/good/quality
none,none
The intense storyline,intense storyline/storyline/intense
Very,
Yes,yes
The detail to the story telling of all the characters and well written storyline helps.,written storyline helps/well written storyline/storyline helps/story telling/well written
I think it is very interesting and attractive to watch it with family and friends,friends/family and friends/think/interesting/attractive
It has a good and interesting story and great actors that complement it.,good and interesting/interesting story/great actors/good/interesting
Good effects,good effects/good/effects
ITS DRAMA AND ITS ACTORS,actors/drama
With the coronavirus I do plan to watch it. It was confusing for me the first time trying to get into it so I didn’t have the time to figure it out.,first time trying/coronavirus/plan/watch/first time
is very interesting show to watch,interesting show/watch/show to watch/interesting/show
The hosts seemingly becoming almost human in their minds,hosts seemingly becoming/seemingly becoming almost/becoming almost human/hosts seemingly/seemingly becoming
the show itself,show
That it is shown in los angeles and that they have the character that I like,los angeles/like/shown/los/angeles
that is so good consider,good consider/consider/good
Thanks ??,thanks
rewqwercwercwercwercwecrwqercwecrqwecrwercqwercwec,rewqwercwercwercwercwecrwqercwecrqwecrwercqwercwec
I am an original fan of the movie that was released in the early 80s also I am a big fan of a video game franchise called red dead redemption and the show Westworld is similar And provides a very unique experience for me as a viewer,early 80s also/video game franchise/game franchise called/franchise called red/called red dead
There are a lot of great acting performances and a lot of shocking twists and turns.,great acting performances/great acting/acting performances/shocking twists/lot
Everything is good,everything/good/everything is good
The scfi part of thew TV series and the actress that play the leading role Rachel Wood .,role rachel wood/leading role rachel/rachel wood/role rachel/scfi part
Is unique an very different from other shows,shows/unique/different
i concept of the theme to reprogram androids lots of interesting characters,reprogram androids lots/interesting characters/reprogram androids/androids lots/characters
it has a good complex story. it has great cast and they act really well,good complex story/complex story/good complex/act really well/story
The care that goes into the production of the show. The attention to detail in the writing.,show/care/goes/production/care that goes
I enjoy the overall storyline.,overall storyline/storyline/enjoy/overall/enjoy the overall
"I like the concept, it makes you think and the actors are top notch. The show just draws you in and keeps you interested.",top notch/concept/notch/like the concept/like
nothing,nothing
curious,curious
"I really like Sci-fi, and Westworld is a new way of the Sci-fi with a lot of dramas",really like sci/like sci/really like/new way/sci
Complex. Something different to watch.,complex/something different/something/watch/different
The premise. The visuals and writing. The plot lines. The acting. I think it's the best show available right now.,premise/plot lines/writing/best show available/show available right
it looks interesting to me,looks interesting/looks/interesting
Dolores's revolution. Serac trying to make the world a better place. Caleb's relationship with Dolores. The technology portrayed on the show.,revolution/dolores/serac trying/better place/caleb
"This weeks episode of the HUGE reveal that DOLORES made multiple copies of herself and stuck them into all the others like HALE, etc... I suspected she was up to no good! “If you want things done right, do it yourself.”",others like hale/dolores made multiple/made multiple copies/like hale/huge reveal
I just really love the concept of big tech becoming a monster and it's creations coming back to haunt them.,big tech becoming/really love/big tech/tech becoming/monster
There is nothing else like it on television. I really enjoyed the environments in seasons 1 and 2.,nothing else like/nothing else/else like/television/nothing
it is the hotest show of the year and all my friends and I watch it,hotest show/hotest/show/year/friends
great,great
no comment at this time.,time/comment
Just an all around great sci-fi show!,around great sci/great sci/around great/sci/show
The visual effects. The futuristic scenes this season will draw me into more episodes.,visual effects/effects/visual/futuristic scenes/episodes
its great over all,great
sci-fi,sci
Evan Rachel wood,evan rachel wood/evan rachel/rachel wood/rachel/evan
It is a good show that I enjoy. Smart and thrilling,good show/enjoy/good/show/smart
the storyline is very good,good/storyline
