"Q148 What, if anything, about Westworld draws you into this show and makes you want to watch? What makes it a good show? (Please be as detailed and complete as possible in your reply.)",YAKE Prediction
I really like the show because it is thought provoking and i like shows that make me think,thought provoking/really like/provoking/like/really
The cast.,cast
Nothing,nothing
"It is the most complex and original idea I have ever seen or heard of. Also, because it delves into the topic of human emotions, but in an artificial way, if I were to be punny and serious all at once. From what I have seen of the show, I believe that we, as human beings, can compare ourselves to the androids, because we can definitely relate to them.",original idea/ever seen/artificial way/human emotions/complex
it has many twists and I like that,many twists/twists/many/like
It's unpredictable so you are left wanting more,left wanting/unpredictable/left/wanting
thrilling and a very exciting show with action,exciting show/thrilling/action/show with action/exciting
It is a very unique show and I never know what to expect next,unique show/show/unique/expect next/next
It’s visually interesting,visually interesting/visually/interesting
love anything ed harris or thandie newton are in,love anything/thandie newton/love/anything/harris
The acting and writing are amazing and it has a great story,great story/story/acting/writing/amazing
"Westworld is a complete show, from start to finish, its plot keeps you interested and intrigued by what may happen. It has a unique theme and plot in my opinion, combining in a great way the genre of science fiction with the drama and problems that afflict us today.",complete show/may happen/plot keeps/westworld/show
Its different than the other show I watch,watch/different/show
how they try and make a new way to be different then others,new way/others/different then others/try/make
I like the subject.,subject/like the subject/like
The overall futuristic concept of living in that (simulated) time period. The characters are all engaging and support their individual and collective agandas with determination and steadfastness.,overall futuristic concept/time period/overall futuristic/futuristic concept/simulated
Than you.,
I like the action and parts in which they get killed by the bad guy,bad guy/get killed/guy/like/action
love the complexity of characters and how it makes you think critically,think critically/love/critically/love the complexity/complexity
The aspect of the show that revolves around what makes people humans. The acting is also great.,makes people humans/people humans/revolves around/makes people/humans
The characters,characters
THE CHARACTERS,characters
"I absolutely love the scenery and the music. The music is best in show, best in class. I've always been an Evan Rachel Wood fan and she carries the series very well. The overall tense and somber mood is drawing for me. I'm always excited to see what lurks behind each episode.",evan rachel wood/absolutely love/love the scenery/rachel wood fan/evan rachel
it is very good,good
Westworld is a drama series of a darkodyssey about the dawn of artificial and evolution of sin,drama series/westworld/sin/evolution of sin/drama
Nothing else,nothing else/nothing/else
the AI and sci-fi storyline and some of the characters,sci/characters/storyline
I don't love love it. Too violent,love love/love/violent
not sure it is very confusing now,sure/confusing
I like that it have a virtual reality setting where the character can go to any setting of the time line to protect there friend,virtual reality setting/virtual reality/time line/reality setting/friend
its full of twists,twists/full of twists/full
"Complex story line, artificial intelligence",complex story line/artificial intelligence/complex story/story line/complex
"I really liked the first season. I'm not too impressed with the rest. I guess I keep comparing it to the original movie, which I really liked.",first season/really liked/season/really/liked
It’s a show my friends recommended to me and I started watching.,friends recommended/show/friends/recommended/started watching
It doesn’t,
the story of the show is very engaging,engaging/story/show
it is a binge worry,binge worry/worry/binge
"Futuristic Scifi, AI, sentience/consciousness, what is life? what is real? revealing the wider world beyond the parks (and the other parks), the architecture",futuristic scifi/scifi/sentience/consciousness/futuristic
The artificial intelligence aspect and Jeffrey wright,jeffrey wright/artificial intelligence aspect/artificial intelligence/intelligence aspect/jeffrey
is very good,good
"interesting plot, interest to see how reality and 'fiction' merge in the show",interesting plot/fiction/interesting/plot/interest
Engaging,engaging
It a how that goes beyond the typical sci-fi story and tells the side of machine trying to survive and gain it's on identity.,typical sci/goes beyond/machine trying/sci/identity
It has very good acting and plot lines I'm always surprised by,plot lines/good acting/lines/good/acting
What draws me to Westworld is the thrill and excitement of every scene. I like the unexpected plot twists and how characters form bonds with one another. It is a good show because of the complex plot and the intrigue of its characters,every scene/westworld/unexpected plot twists/characters form bonds/scene
I like the plot of the show,like the plot/show/like/plot
The plot twists and expanding further into the westworld universe,westworld universe/plot twists/universe/plot/twists
The entire concept of AI and alternate realities interests me.,alternate realities interests/entire concept/alternate realities/realities interests/entire
Good show to fall asleep to.,good show/show to fall/fall asleep/good/show
"The story is amazing for starters. The acting is top notch, the story telling is awesome and the overall show is wild fun.",story telling/story/starters/top notch/wild fun
the mistrey,mistrey
Comparing the original version to the new version,original version/new version/comparing/version/comparing the original
It's storyline. The show is very right for today. Culturuly. It touches on alot of topics that are taboo,storyline/culturuly/today/show/right
"i like the thriller of it , the plots i can't wait to see how it pans out and the hero's that make the show",wait/hero/show/wait to see/make the show
"I enjoyed the futuristic story lines, AI, Characters in all 3 seasons, but season 3 is too complex.",futuristic story lines/story lines/futuristic story/characters/lines
the cast in the show & the overall storylines/concept draws me into this show. This is a storyline that i feel like we will be living in the not to distant future,overall storylines/concept draws/show/storylines/concept
i like the story,story/like the story/like
nudity,nudity
"The writing is great. When this show originally aired I felt as though it hit a new exciting way to portray the future and the possibilities of a fully human-like AI. And one my favorite parts is how they incorporate the songs (for example, Paint it Black) into the soundtrack to the show, but played on an old time piano, or the background music to a scene. It’s so clever and once I picked it up it’s something I look forward to every episode.",show originally aired/new exciting way/great/old time piano/fully human
"DescriptionWestworld isn't your typical amusement park. Intended for rich vacationers, the futuristic park -- which is looked after by robotic ""hosts"" --",typical amusement park/typical amusement/amusement park/park/descriptionwestworld
"It's characters and story telling are great. I love the manipulation of time in the first season, and the changing perspectives of the characters as they become more aware",story telling/great/first season/characters/telling are great
I like that the current season is more futuristic. I like that the storylines are complex.,current season/like/futuristic/current/season
BEST AND SO,best
it is just such a great break from my reality,great break/reality/great/break
Friends talk about the show and it makes me want to watch to see what all the fascination is about.,friends talk/want to watch/friends/talk/show
The plotline is one that I've never encountered.,never encountered/never/encountered/plotline/one
A different storylines and different characters,different characters/different storylines/characters/storylines and different/different
it is very good i like it very much,good/much/like
It’s definitely different and not like any other shows.,definitely different/definitely/shows/different/like
"Unpredictable plot line, evolution and growth of characters, interesting",unpredictable plot line/interesting/unpredictable plot/plot line/unpredictable
i like the story and character,character/story and character/like/story/like the story
Season 1 was good but season 2 became too much,much/season/became too much/good/became
Sci-fi and my love for westerns,sci/westerns/love for westerns/love
It is different,different
It’s interesting and different,interesting/different/interesting and different
The artificial intelligence surrounding the plot and also the genius behind the director as well as story line.,artificial intelligence surrounding/story line/artificial intelligence/intelligence surrounding/also the genius
I can’t remember,remember
The depth of the characters and the intriguing of the future civilization,future civilization/civilization/depth/characters/intriguing
this is an awesome show and i love it,awesome show/awesome/show/love
Call my phone and call my number one phone call my number number again call my phone call my name number is so call my number call call my phone call call my call number call call my phone number is and call call me back I wanna was the day I wanna was the time,call/call call/number/phone call/one phone call
None,none
knowing that some day this will be a reality,knowing/reality/day
I enjoy sci fi and west world fits that genre well with good characters and plot,west world fits/enjoy sci/west world/world fits/genre well
It so different from any other show I've watched. The characters are so interesting and to see the AI characters making their own decisions is disturbing and scary.,watched/different/show/characters/scary
No comment was made about the concept of the fact that it has a lot of redeeming features,redeeming features/features/comment/made/concept
The drama is outstanding.,outstanding/drama is outstanding/drama
The wonderful story line,wonderful story line/story line/wonderful story/line/wonderful
I enjoyed season 1 and season 2 and plan to watch season 3 completely as soon as my spouse catches up,completely as soon/spouse catches/enjoyed season/watch season/season
the story is always crazy and keeps you on your feet,always crazy/feet/story/always/crazy
I liked the original movie that it is based on,original movie/liked/original/movie/based
it is always new and thrilling,always new/thrilling/new and thrilling/always/new
i love the characters and the storyline. it always keeps me on the edge,love the characters/storyline/love/characters/always keeps
I LOVE THE DIFFERENT STORYLINES AND THE ACTORS,different storylines/actors/love/different/storylines
Its such a wild fantasy that was put in to a good cinema,good cinema/wild fantasy/cinema/wild/fantasy
The idea of it is interesting .,interesting/idea
It is a genre that I enjoy. It is suspenseful and has you very immersed in the shoe,enjoy/genre/shoe/suspenseful/immersed
The opening song and images because it depicts a futuristic ability which indicates the shows contents.,shows contents/opening song/futuristic ability/contents/opening
"it is the best current show, the best theme, impeccable performance, I love science fiction",love science fiction/best current show/impeccable performance/current show/science fiction
the acting is really great and feels real and the story and world they live in is pretty wild and I love to see the future,really great/great and feels/feels real/pretty wild/future
"I like the complexity of the show, the imagination of the writers.",like the complexity/show/writers/like/complexity
The storyline of Westworld draws me to watch more episodes.,westworld draws/westworld/episodes/storyline of westworld/watch more episodes
I stopped watching the show after season one so this question has no answer.,season one/stopped watching/one/stopped/watching
scifi,scifi
excitement band different,excitement band different/excitement band/band different/excitement/different
friends recommendation,friends recommendation/friends/recommendation
"This show is well acted, has beautiful scenery, some good special effects, a convoluted story line, with twists. This series involves some of the most talented writers and actors of our generation.",good special effects/convoluted story line/well acted/beautiful scenery/special effects
the action scenes and the story,action scenes/story/action/scenes
I haven't watched it in a few seasons so I'm not sure,watched/seasons/sure
I love the storyline. It's stupendous and wonderful,storyline/love the storyline/love/stupendous/wonderful
the staring cast and the story lines,story lines/staring cast/lines/staring/cast
Mostly the production value and the music,production value/mostly/music/mostly the production/production
Is unique and unlike anythign else on television,unlike anythign else/unlike anythign/anythign else/television/else on television
Season 3 is nothing like the first two and I am almost ready to stop watching the show,nothing like/first two/almost ready/stop watching/season
Nothing,nothing
I like that it takes place in a unique world that lets me get away and get involved into the characters lives and stories.,takes place/unique world/characters lives/get away/get involved
I enjoy the plot twists and puzzles,plot twists/puzzles/twists and puzzles/enjoy/plot
The music fitting the scenes,music fitting/scenes/fitting the scenes/music/fitting
"I love the detail of the show, it puts me in suspense.",love the detail/show/suspense/love/detail
My friends are talking about it. Seems interesting as to what the “robots” will do next after getting out but I’m not a big fan of si-fi don’t watch it enough to keep up,robots/friends/talking/seems interesting/friends are talking
I enjoy that there are always twists and turns. Thandie Newtons character is amazing. She is strong and determined.,always twists/thandie newtons character/thandie newtons/turns/newtons character
It really intrigues me. I like following the characters and story line.,really intrigues/really/intrigues/story line/line
I like the characters and the actors who play them,like the characters/like/characters/actors/play
I like shows that intentiobally cibfuse and make you think,like shows/intentiobally cibfuse/think/make you think/like
The characters of the show draws me in and the scenery of the show,show draws/show/characters/draws/scenery
Very thought provoking and unlike anything else on tv,unlike anything else/thought provoking/unlike anything/anything else/thought
Nothing,nothing
The idea of technology advancing beyond its program and the dangers it can result in,technology advancing beyond/technology advancing/advancing beyond/idea/technology
How it’s so unlike anything else I’ve seen.,unlike anything else/seen/unlike anything/anything else/unlike
"The excellent acting, the writing and dialogue, and the characters. Also the exploration of themes like big data and privacy, which are super relevant now.",excellent acting/themes like big/like big data/acting/dialogue
its to good and i like it very much,good/much/like
it has some really interesting perspectives and ideas that they explore in cool and interesting ways.,really interesting perspectives/interesting ways/really interesting/interesting perspectives/cool and interesting
It has a good story line but was too slow for me,good story line/good story/story line/good/story
is good,good
Its all good,good
"Great acting and thrilling, interesting plots",interesting plots/great acting/great/thrilling/interesting
nothing I found it odd and confusing a stopped watching it,stopped watching/nothing/found/odd/confusing
"The mix of genres is interesting, there really is nothing like Westworld, it is uniquely its own show",nothing like westworld/like westworld/nothing like/westworld/interesting
The unexpected storylines,unexpected storylines/storylines/unexpected
I think the main thing that drives me to watch Westworld is trying to figure out who is human and who is a robot. I do like seeing high profile actors in the show. I do like the visuals a lot.,watch westworld/main thing/westworld/robot/westworld is trying
charaters,charaters
The cast and technology concept of the show,technology concept/show/cast/technology/concept
I think it would be the complex story line and plot but I couldn't really get into it because I thought season one was boring and confusing,complex story line/complex story/story line/thought season one/plot
It is from a brand that produces high quality entertaining shows,quality entertaining shows/produces high quality/high quality entertaining/entertaining shows/produces high
The exploration of AI and big data in a futuristic setting,futuristic setting/big data/setting/exploration/big
enjoyed first 2 season but now that they are in the real world its not as interesting.,enjoyed first/real world/enjoyed/interesting/first
i have only started the series and am in season one,season one/one/started/series/season
I love the storylines and all the twists and turns. Also the violence and action keeps you emgaged,turns/twists and turns/love/storylines/twists
The multiple story lines,multiple story lines/story lines/multiple story/lines/multiple
The concept of the show. And the acting of the cast is what makes me want to watch it. It's a very good show.,show/good show/concept/acting/cast
The characters and what it is about,characters
The graphics and effects are awesome but the storyline is just straight up ridiculous,ridiculous/straight up ridiculous/graphics/effects/awesome
It’s a good movie,good movie/movie/good
It’s got very intriguing story writing that keeps you attentive. I also love all the futuristic aspects to it.,intriguing story writing/intriguing story/story writing/got/attentive
all of it really good.,really good/good/really
Great story lines and character development. Always curious about what's next.,great story lines/great story/character development/story lines/next
I really love sci-fi shows,really love sci/love sci/really love/sci/shows
Just really interesting characters. Dolores specifically is a very unique character with motivations that keep the show engaging,really interesting characters/interesting characters/really interesting/characters/really
I loved the first two seasons and I want to see where season three leads,season three leads/first two seasons/three leads/first two/two seasons
mone,mone
The writing is excellent,excellent/writing is excellent/writing
I like the premise of the show being futuristic and the action involved,action involved/like the premise/involved/like/premise
Not knowing what is real or fake,fake/real or fake/knowing/real
Perfect,perfect
od when you Live Well]? Please write down the,live well/well/live/please write/please
I like the characters and the stories,like the characters/stories/like/characters
Good acting. This year it is difficult to follow,good acting/good/acting/follow/year
Its a new and unique concept for a show. The writing and acting make it a good show.,unique concept/good show/show/new/unique
It is a show unlike any other I've seen and people talk about it. Also fun to explore the theories people have on each week's episode,show unlike/people talk/seen/episode/people
I really like the unique storylines as well as the acting.,really like/unique storylines/storylines as well/acting/really
This is a show that is not like any other show on television. It keeps me on my toes and I'm always waiting for a plot twist. It challenges it's viewers to think beyond.,show/television/like/show on television/always waiting
well written story that's different than other series I have watched.,well written story/well written/written story/well/different
I like the characters in the show and want to see more of the role they play.,like the characters/play/role they play/like/characters
The only thing that would make me think it's a good show is that it's on HBO and I usually like their shows.,would make/good show/hbo/thing/would
"its different , the stories inside the story",stories inside/different/story/inside the story/stories
"Watched original from years ago. Like seeing how AI can be good or bad. ...mostly bad, hope public wakes up.",watched original/years ago/watched/ago/bad
anything,anything
It is beautifully scripted,beautifully scripted/scripted/beautifully
I REALLY LOVE ALL OF THE ACTORS AND ACTRESSES ;),really/love/actresses/actors/actors and actresses
not sure,sure
"I began watching the show because I love the acting style of Anthony Hopkins. I kept watching the show because I am drawn to shows that have mystery, intrigue, twisting story lines, and characters that I can root for.",anthony hopkins/acting style/began watching/twisting story lines/hopkins
"I am into West World because I was a big fan of the 70s moving starring Yul Brenner , and I'm definitely interested in this season because they are including a lot of futuristic gadgets.",starring yul brenner/moving starring yul/70s moving starring/yul brenner/west world
This show keeps my guessing every second that I watch it. I'm always on the edge of my seat when watching this show.,guessing every second/guessing every/every second/show keeps/show
i like the new concept for serie,new concept/serie/concept for serie/like/new
"The show does a great job of character development. Each episode builds upon the other, revealing bit by bit their motivations, fears, and thought process in a seamless fashion.",character development/great job/development/fears/show
"the characters, the actors and the places where the story takes place",story takes place/takes place/story takes/characters/place
"it holds your attention, it is something you wait to watch, it is something you can talk to others that watch about",something/attention/watch/holds your attention/holds
i love the dramatic setting,dramatic setting/setting/love/dramatic/love the dramatic
I love the future of technology and how AI is taking over just like some people are warning us about now,love/future/technology/taking/like
Everything,everything
I heard my mom talk about it and it caught my interest,mom talk/interest/caught my interest/heard/mom
I just really like the futuristic aspect of the show,really like/futuristic aspect/show/really/like
the acting and storyline,storyline/acting and storyline/acting
The overall content,overall content/content/overall
Great acting,great acting/great/acting
The quality of the show and storyline,storyline/show and storyline/quality/show
I enjoy sci fi and AI. This show is very interesting to me,enjoy sci/enjoy/sci/show/interesting
the characters are well selected. They can act and i feel engaged with the storyline,well selected/selected/characters/well/characters are well
perspectives of both the androids and the humans is appealing to me. The plot twist will leave you wondering whats next.,perspectives/androids/humans/appealing/plot twist
love this series,love/series/love this series
"The acting, the writing, and I love that it makes you pay attention and think.",pay attention/acting/writing/think/attention and think
Nothing,nothing
i love the characters in the movire,love the characters/movire/love/characters
It has a thrilling and dramatic storyline that is unique and is never predictable.,never predictable/dramatic storyline/predictable/thrilling/dramatic
"It is very confusing, overall, but trying to figure it out is interesting. It is a bit like the show Lost in that way. I like the idea of AI and especially the character of Dolores.",overall/show lost/confusing/interesting/trying
Proragonist and Antagonist co frontation,antagonist/proragonist/frontation/proragonist and antagonist/antagonist co frontation
Unique ness,unique ness/unique/ness
"It is unique, grasping, intelligent, interesting, with a lot of twists and turns",grasping/intelligent/interesting/unique/turns
It's a surprise at every turn. You're not sure whose right and who's wrong,every turn/wrong/turn/surprise/every
Aaron Paul is what made me watch it in the first place. I like the story lines that makes the show interesting every week.,aaron paul/first place/interesting every week/paul/show interesting every
You don't always know who is good or bad.,always know/always/bad/good or bad/know
"A lot of my friends watch this show, so I like that we can get together and talk about it.",friends watch/get together/show/watch this show/lot
I watched the original Westworld in the seventies. I like seeing the updated and recreation of that brand. I like the premise of A.I or robots turning on humans. I like the setting of an amusement park where I think people become more entitled and self absorbed. It’s a very interesting setting to have artificial turn on humans. I like the unsettling nature of the show and the survival aspect. I kind of like the darkness of the stories.,original westworld/like/westworld/like seeing/seventies
I like the characters and the genre of the show that keeps me captivated snd want to watch,captivated snd want/like the characters/captivated snd/snd want/watch
I love the story line and the characters. It has a very interesting plot and my wife and i don't miss it every week,story line/characters/love/story/line
